PYF6X0V,male,23,"I was listening to the wma files on my Muvo and when it got to this one, I felt so touched. It's a lovely song by John Denver. The CD version I had was sung by a lady and the CD was The Best of Audiophile.  What hit me were the thoughts in brackets as I listened to it:  Perhaps love is like a resting place  A shelter from the storm (Finding Ian was a respite from the choppy waters my life's been) It exists to give you comfort It is there to keep you warm (Ditto... thought of the times Ian's been there when I was suicidal, sad, cold, depressed,...) And in those times of trouble When you are most alone The memory of love will bring you home (whenever i am down, i think of ian and he brings me home... like Dory told Marlin "" When I'm around you...It's like I'm home."")  Perhaps love is like a window Perhaps an open door (ian and i both turned away from ""closed doors/windows"" to find each other. As the saying goes- When God closes a door, he opens the window) It invites you to come closer It wants to show you more (Will you let me do that my dearest?) And even if you lose yourself And don`t know what to do The memory of love will see you through (Nods nods... I hope Ian feels the same)  Love to some is like a cloud (I used to believe in it being ephemeral) To some as strong as steel (Not any more) For some a way of living  For some a way to feel (I live and I feel loved and I give my love... I hope it is enough compared to the abundant love you give me dar') And some say love is holding on  And some say letting go (how true...) And some say love is everything (you are so important to me dearest... u dunno how.) And some say they don`t know  Perhaps love is like the ocean Full of conflict, full of pain (oh yea there will be bad days right? but we'll pull through) Like a fire when it`s cold outside (yea you keep me safe and warm... seeing me home the way you do.) Or thunder when it rains  If I should live forever And all my dreams come true (most of them have the day i found you) My memories of love will be of you (always)  And some say love is holding on And some say letting go And some say love is everything And some say they don`t know  Perhaps love is like the mountains Full of conflict, full of change Like a fire when it`s cold outside Or thunder when it rains If I should live forever And all my dreams come true My memories of love will be of you   Words and music by John Denver"
PYF6X0V,male,23,"The first time I came across this book was when Mirja Kramer, my German schoolmate, gave it to me one day telling me that it was a book I would appreciate.  And she was right.  In fact  ""The Prophet"" is a book many can appreciate. The words strike true and resound with wisdom.  The last few entries were excerpts taken from that book.  It's worth reading and worth contemplating.  My only regret is that I dun have that bk anymore... but u can find it online and also in bookstores.  Food for the soul trapped in a web of busy-ness and forgetfulness..."
PYF6X0V,male,23,"Oh Yes Wyoming!   ""Oh Yes Wyoming!  With the trees and the horses and the rocks and the sheep  Oh Yes I'm Going! Through the plains and the trails and the streams and the hills  Oh No Nebraska! Is there a plainer state I ask ya?  Oh Yes Wyoming! There's no place I'd rather be roaming With the geysers and the canyons and the watering holes With the geysers and the canyons and the watering holes  Oh Yes Wyoming! With the mountains and the lakes and the plentiful fish  Oh Yes I'm Knowing! This land will fulfill my every wish  Oh No Dakota! Doesn't interest me one i-ota  Oh Yes Wyoming! There's no place I'd rather be roaming   (Spoken) ""Hey Zinc! What is it Antelope Joe? You know, I love them girls back in Wyoming I heard you love the geesyrs too It's gysers, and anyways that's just a rumor I'm talking about my special girl Daisy I call her Old Faithful I heard she aint that faithful She sure is old though!"" (Laughter)   Oh Yes Wyoming! With the cabins and the camping and the bakin' beans  Oh Yes I'm Glowing! With the bison and the banjos and the wily racoons  Oh No Ohio! I can hardly wait to say goodbye-oh  Oh Yes Wyoming! There's no place I'd rather be... Ends with m-i-n-g... Shout it out loud with me W-Y-O-M-I-N-G  Oh Yes!  ===> http://www.jerry.digisle.tv/room_nocapture.html (The best AMEX ad I've ever seen... I love what they did to Superman hahahahahaha)and IF you want the mp3 download to annoy the arse out of ur frens and family: http://www.mathcaddy.com/OhYesWyoming!.mp3"
PYF6X0V,male,23,"And a woman who held a babe against her bosom said, ""Speak to us of Children.""   And he said:   Your children are not your children.   They are the sons and daughters of Life's longing for itself.   They come through you but not from you,   And though they are with you, yet they belong not to you.   You may give them your love but not your thoughts.   For they have their own thoughts.   You may house their bodies but not their souls,   For their souls dwell in the house of tomorrow, which you cannot visit, not even in your dreams.   You may strive to be like them, but seek not to make them like you.   For life goes not backward nor tarries with yesterday.   You are the bows from which your children as living arrows are sent forth.   The archer sees the mark upon the path of the infinite, and He bends you with His might that His arrows may go swift and far.   Let your bending in the archer's hand be for gladness;   For even as he loves the arrow that flies, so He loves also the bow that is stable."
PYF6X0V,male,23,"Jsut had an argument with Mum.  Talking to her is like talking to a brick wall. We're arguing about the money thing between Aunty Ida and her again. How hard is it for her to draw the money out and return to them?  She insists that I am asking her to scold them and that I dun wanna be friends with Keith. She is upset that I only let Keith see him once in three weeks instead of once a fortnight.  Firstly, I just want her to tell them politely that now that I am working, we can handle the financial aspect already. Secondly, I do talk to Keith and I am not rude or mean to him. And she say she cant change her account because it is her Giro account yada yada yada but then how hard is it to draw the cash out to return?  She is obviously making excuses.  And why isn't she on my side regarding visitation? And he is my child and her grandson... does she rather all the transitions for him to be harder? This way it is easier for everybody to move on...  Someday Keith will move on and have his own family & so will I and Kae...  I am just so tired... think I will change my clothes and go to church even if I am late... I need the Lord's solace and wisdom.  BS"
PYF6X0V,male,23,"1) Single or Taken: taken  2) Gender: Female  3) Birthday: 19/04 4) Sign: Aries-Taurus cusp  5) Siblings: nada 6) Shoe size: ... : p not sure hahaha 7) Favorite sport: Surfing the net hahaha... swimming? running after kaelen?  *-;-* T h e E x t r a S t u f f *-;-*  1) Have you ever smoked?  NO. NEVER WILL.  2) What kind of shampoo do you use?:  Amway's Satinique (damn solid... ceramide infusion etc)  3) What are you most scared of?  Losing my loved ones...  4) What are you listening to right now?  Brandy's Talk About Love 5) What vehicles do you wish to have?  I wish to have my left ""car"" and right ""car"" working fine till the day I die. 6) Who was the last person who called you?  Ian 7) Where do you want to get married? For me to know and for Ian to figure out... not saying here...that will be too ez! ROFL 8) How many messenger buddies do you have online rite now?  Many many much much. 9) If you could change one thing about yourself, what would it be?  Be more organized and patient and less annoying.   *-;- *F a v o u r i t e s *-;-*  1) Color: blue, lilac... the lightest pink 2) Food: Hainanese Chicken Rice!! 3) Guy's names: Kaelen (grins),  4) Girl's names: Marlene (MAH-LAY-NER),   5) Animal: Kitty! 6) Games: C&C   *Ha v e Y o u E v e r*  1) Given anyone a bath?: Yesh 2) Done something so stupid you couldn't sleep at night?: Ya... mostly to do with my handphones... 4) Broken the law?: Nods... but never found out. 5) Made yourself throw up?: Stomach Flu times... 6) Made yourself cry to get out of trouble?: When I was a kid...  * F i r s t T h i n g T h a t C o m e s T o M i n d*  1) red : head 2) cow : moo 3) Socks:  clocks 4) Greenland: Finland  * ~ F i n a l Q u e s t i o n s ~ *  1) Do you like filling these out? See how lor... Bor Liao I will... diz da 2nd i am doing 2day.  2) How many people are you sending this to?: Just posting it up on my blog for ppl to throw eggs at it... then again, not many peeps read or know abt my blog 3) Who will send it back?: Nada. Zilch. Nil. Kosong. Zero?! 4) Gold or Silver?: Platinum!  5) What is the last movie you saw?: Shrek 2! 6) Favourite cartoon characters? Aiyoh too many to list... but all time favorite ah.... Sun Gokou! 7) What do you have for breakfast in the morning?: Keeps on changing... and somedays none!  8) Who would you hate being locked in a room alone with?: My Mother... (no contest again) 9) How long did you take to write this? I dunno. I dun care."
IJK27LV,male,23,hmmm....90% of my paycheck gone before i see it...DAMN BILLS!!
IJK27LV,male,23,it's been awhile....life is still pretty sucky...and school starts in just a lil over a day now...
IJK27LV,male,23,"w00t, got the scripts for 05 and 06! and once i get home i'll be downloading this weeks episode, 10."
IJK27LV,male,23,i have to add i hate it when ppl leave w/o letting me say bye or night or anything...
IJK27LV,male,23,*sigh*
IJK27LV,male,23,weeeee... i take daily vitamin now... it chewable
IJK27LV,male,23,"169 days, 5 hours, 7 minutes till Nemesis premieres.... o.O"
IJK27LV,male,23,"last night's dreams were much better, a little on the strange side, but good enough that i considered calling in sick just so that i may fall asleep and dream some more..."
IJK27LV,male,23,Disorder      Rating        urlLink Paranoid :    High       urlLink Schizoid :    Moderate       urlLink Schizotypal :    Very High       urlLink Antisocial :    Moderate       urlLink Borderline :    Very High       urlLink Histrionic :    Moderate       urlLink Narcissistic :    Moderate       urlLink Avoidant :    Very High       urlLink Dependent :    Very High       urlLink Obsessive-Compulsive :    Moderate       --  urlLink Personality Disorder Test - Take It!  --
IJK27LV,male,23,"so, i've been playing  Knights of the Old Republic  getting to choose dark things is fun, ""YOU KNOW TOO MUCH! YOU MUST DIE!"" seriously tho, why Lucasarts keeps shoving the trilogy based game shit down our throats is ridiculous, the Expanded Universe has so much more, and this game has sold so well maybe they'll notice and make more... i mean, they can't say EU games will fail anymore after seeing the numbers on a game set 4,000 years before the fall of the Republic. It doesn't get much more ""expanded"" than that... or does it?"
XKAXHN1,female,24,urlLink This  is my new favorite website.
XKAXHN1,female,24,"So, we called the plumber back about our sink issue yesterday.  It turns out that sometimes when a plumber does really intense work, such as replacing a bunch of pipes, the disruption can cause rust and deposits to drop into the lines, and when you turn on the water, all of that stuff gets flushed to the end of the faucet, blocking the water flow.  Sure enough, Matt removes the end of the faucet, and there's a bunch of crusty crap in the filter.  This is a good thing to know, considering the calls I get at work!"
XKAXHN1,female,24,"I think that I'm more aware of the people on the bus now that I'm posting my thoughts online...They provide such great material!  Yesterday someone moved from their spot 2 seats down from me, to sit right next to me.  For no particular reason - he didn't even try to start a conversation.  He was a really sweaty bike-rider, and it grossed me out.  This in turn prompted me to hold onto the metal pole, so as not to accidentally bump into ""sweaty biker guy"" if the bus lurched to a stop.  A few moments later, someone else boarded the bus.  We'll call him ""sweat-pants man"".  When ""sweat-pants man"" got on the bus, there were tons of empty seats.  He opted to stand right in front of me, and lean against the pole, in such a way that his ass was  right above my hand .  I was wedged between ""sweaty biker guy"" and ""sweat-pants man"".  Ugh.  Now, I'm not overly sensitive about personal space.  You really can't be on public transportation.  But  c'mon  people!"
XKAXHN1,female,24,"Matt took me to a very nice dinner for my birthday on Saturday.  If you're ever in Seattle and want a treat, go  urlLink here .   We were walking across the street to the restaurant, and I had a highly entertaining conversation with a woman who was walking in the opposite direction:   Her - Nice dress.  Me - Thank you.  Her - You're welcome, Bitch!   The moment that last word exited her mouth, I recognized her.  I looked right at Matt and said, ""Wow!  I've run into her before!  I remember her complimenting me on something, and then calling me a bitch!"".    That moment totally made my birthday."
XKAXHN1,female,24,"Matt and I keep the bedroom door closed, so that the cats don't molest my clothing and bedspread, leaving a trail of cat hair behind. This morning I learned the dangers of having a push-button lock on your bedroom door. We're still trying to figure out who is responsible, but I  do  know one thing: After my shower, I couldn't get dressed because the bedroom door was locked. I tried jamming a pen in the little hole on the outside, and I even tried sliding an old atm card down the space between the door and the frame. Nothing worked. It was time to channel  urlLink MacGyver .  Our house has 2 bedrooms, which sit side by side, and they ""share"" a closet. When you look into the closet for one room, you realize that you're looking at half a closet. You can see over the wooden barrier, into the other half of the closet, and into the other room. I think at one time, the two bedrooms were a walk-thru of sorts.  So, Matt boosted me, wearing only a bathrobe, up to the shelf in the closet of the room that we could still access. I managed to turn myself around so that I wouldn't have to dive face first out of the other side, and did this cramped scoot sortof thing until I got to the other side. I looked down - man that's a ways up for someone who's afraid of heights! I started to slide down, and about halfway there, I realized that if I were to continue, I would end up with a bunch of hangers in my face, which could prove painful. I actually managed to pull myself back up onto the closet shelf, leaned over, and started removing clothing from the closet, and throwing it on the floor. I found a  box  on the shelf, which I proceeded to drop on the floor, so  I  wouldn't have to drop as far. Then I turned around again, and braced my feet on either side of the door frame. I scootched myself down with my feet, until my arms and chin were the only thing holding me to the shelf, then dropped.  It was a good morning."
XKAXHN1,female,24,"An email from Mom:    Later in the day I headed out to the garden to see how it was going. Out came the kids all excited. Adventure Cat was going to have babies and Daddy was having problems. I came back in and found Daniel on his hands and knees trying to extract Adventure Cat from a less than desirable area. We finally, after much coaxing and rearranging convinced her to settle for a better spot. That poor cat had one heck of a time! At one point, shortly before popping the first one out somehow managed to jump out of her box and come looking for me. That poor cat could barely keep her hind end off the floor! She was squatting, having contractions and begging me to help to help her. We managed to get her back in the box then the kids and I took turns keeping her company. Lindsay saw the first two being born and Nathan and I saw the last one being born. A most painful experience for the new Mama. Last night she kept trying to take little breaks but every time she'd take a couple steps away the kittens would start crying. She was actually grumbling (almost a growl) on her way back a couple times. LOL Grrrr, durn kids! She was thrilled to see us all emerge from the bedroom this morning and immediately came out to get us and lead us back to her box so we could take turns keeping her company again."
XKAXHN1,female,24,"I finally broke down and ordered a Frappuccino at Starbucks today. I used to get the vanilla ones on occasion, but I stopped when I was forced to admit to the nutritional value of them. Well, today I decided to try the new vanilla bean creme frappuccino, and wow is it yummy! Remember when you were a kid, and you would eat frosting straight out of the plastic container? Well, I don't. I don't think we ever had store-bought frosting as kids, but I can imagine what it was like. The vanilla bean creme frappuccino is  even better  than eating frosting straight out of the plastic container! (or what I imagine it to be like) Props to Mom for making store bought frosting something that I have to imagine, and props to Starbucks for their tasty beverages!"
XKAXHN1,female,24,"In the future, if I'm trying to drink out of a large bottle, I will be more careful if it's mostly empty.  I think if practice this, I'll avoid dousing myself with water."
XKAXHN1,female,24,"Below is an excerpt from an email that I received from my mother.  She is remarried with two small kids, whom she is teaching to read:     First stop was the cigarette store. Daniel ran in while the kids and I waited in the car. While he was in there a pickup pulled up and parked next to it. It had a decal on the side which Nathan immediately set to reading. ""GGG Go-o-o-od, God! BBB-Bl-Bl-ble-ble-bless,Bless! God Bless! Aa ammm-ammmeee-amerrriiii-amerriic-amerriic-amerriicaaa-America! God Bless America!"" He's an American! Lindsay then chimed in ""He's an American! He has an American car! See! He has an American Flag!"" They were both so excited to be parked next to an American with an American car! When he came out I was tempted to thank him for keeping my kids busy :-)"
XKAXHN1,female,24,"My eight year old nephew is staying at our house for the weekend, and we're having a great time sofar. Last night Justin took a shower before bed, and came out to say goodnight wearing khaki shorts and a button up dress shirt.   Me:  Justin, why are you wearing that?  Justin:  This is what I'm wearing tomorrow.  Me:  I get that, but why are you wearing it now?  Justin:  Mom didn't pack any pajamas for me.  Me:  Huh. Well, you can't be comfortable in that; why don't you wear one of Matt's Tshirts?  Justin:  No, this is fine.  He then proceeded to pull the blankets back and crawl into bed, wearing belt and all. My nephew is a freaky kid.  This morning Justin came out of bed ready made! Matt made blueberry pancakes for breakfast. Afterwards, I mentioned something about brushing teeth, and Justin just looked at me.   Me:  Lemme guess, you're mom didn't pack a toothbrush for you?  Justin:  Yeah! (giggle)  Me:  Well, we just need to pick one up for you today.  Justin:  She packed a sweater for me.  Me:  Yeah, I saw that. A nice knit sweater - perfect for winter, but no toothbrush. Next time I'm sending your mom a checklist."
AROUG22,female,16,urlLink    puggaz  urlLink
AROUG22,female,16,"ayte laz saturdae i went to d 2004 baybeat wit my sis n it was damn fuckin kool!!!!i wore a retro shirt,black tight denim skirt,sk8 shoes n a black eyeliner wahkk!!!hahahaha n i think i look okey bt i wen i reach der i realised i was d dumbest coz other people were nicer,cooler n prettier wahk!!!!n i guess my position der was low...hahha bt i truly enjoyed myself..i saw sam and masahi at d baybeat n realized dat sam had dyed his hair frm a blonde dude to a dark brown hair clred dude mwaheaheaheaheha he looks kool bt i don agree wit d side bern hahahhahaha look stupid...d coolest thing is he is standin bside me while smokin n watchin d group ""venus butterfly""......n his smoke is stuck on my shirt yay!!!!!!!!!!!!!!!!!!!!!!anyways i haven wash my shirt coz i still wanna smell sam hahhahaha he stand exactly bside me bt juz 4 several min coz after dat his fren was busybody n say ""excuse me"" n overtook my place...fuck him!!!!!!!n wen i was goin bck home,i saw masahi n d drummer of buddhiston....hes cute n kool....hhahahahhaa n wen we were watchin venus butterflyperform der is a bunch of guys who were standin bside us n dey r damn fuckin funny...once dewres diz guy who make a sound ""RRRRRRRRrrrrrr"" hahhahahaha in a cute way coz d girls of venus butterfly are cute n sexy...dey make loadz of stupid jokes bt funny..d guy also had a dimple in his smile...awwww so cute.....:p anyways 2dae raz did not turn up to skool....fuck him!!!!2dae durin skool talk,my class sat exactly bside his class n i sat at d boys side n hes absentZ!!!!!!!!!!such a waste!!!!n yesterday i wen to d jamiyah centre were d drug addicts are kept n my cousin which was in der 4 d past 5 years..at laz ive seen him...warrggghh!!!!quite miss him n hes 32 diz year..old already....bt hes still look stylish eventhough stuck in der....he wore a black shirt,grey pants,light n dark brown sneakers n a wrist band...wit waxed hair!!!!!!!!!!wahk...we ate at d same table n i enjoyed it...i haven seen him since im 11 n im 16 now...5 long years....hes d best cousin ever bt such a waste he took drug...d good thing id he never change at all...wen i met him d 1st thing he said was""wow...u r so big now!!!""hahhahaa n i juz smile....he asked me loadz of question like hows skool n hows things goin on in my life...cool huh?we had quite a good chat...i like it wen my mum told him dat im addicted t music n he said ""yah i noe,by d wae she dress i can tell it""god dammit...hes d 1st person who compliment on my clothing!!!!!!!!!!!wow!!!!!!!!!!so flattered.....i like him as a cousin!!!!!!!!!!!!!!:p....in d end wen i wanna go bck home,he said,study hard n wave me goodbye....i felt nice n easy wen i went bck home coz he compliment my clothing n wave gdbye which other cousin of mine hav nt ever done it....yea hes cool..he will b goin outta dat place diz december...so ima countin d days....n wan lalat frm force vomit truly rawk!!!!!!!!!!!!!!!!!1i love him..wit his new hairstyle hes total cutie....wahk!!!!!!!!!!!!!!!!!im meltin....n d baybeat deres lotta cuties wahk!!!!!!!!!!!anyways love u raz"
AROUG22,female,16,im feelin so so so damn fucked up now.....im burning inside!!!all d indians are stupid!!!!!!!!!!im so sorry no offence der....my name is sheila which coincidently is similar to indian girls name and in my yahoo messenger most of the indiands tot im an indian n speak indian language on me!!!!!!!!!!wat d fuck???i got it every single day!!!!!!!!im so fucked up!!!!!!!!!!!!!!!stupid barbarians idiot!!!!!!!!!!!!!fuck you all!!!!!n worse to add to my burnin my mom cancelled d trip to kuala lumpur!!!!!!!!!1damit..ive already pack my beg and clothes and my mom said it was a last minute cancel...n im like wat d fuck is it goin on hurr??!!!!!!!god dammit!!!!!!!!!!!im fucked up!!!!!!!!!!!!!!!
