0SB3JU3,male,17,"You people should really come online and give me a purpose in life, seriously, I'm bored as hell.....and I would know, hell is boring.  I just got home from my Japanese meeting an hour ago, where I learned when I'm leaving and who my host family is and all that good stuff.  My host family seems nice, and they don't smoke, and they have 2 kids, a 16 year-old daughter and a 13 year-old son.  So, that could be pretty kool.....as soon as Ashley*my friend* read the people in my host family she was like, OOOO, a 16 year-old girl ;-)  Ya right, if i can't get any american chicks, what makes her think that sumone from a totally different country would show any interest.  Also a notable note, I'm the ONLY guy going on the trip, I'm the only male, all the rest are of the female species....I haven't decided if this is good or bad.  Last night was fun though, I got home from my mom's house about 9:00ish, and I got online*of course* and instantly I was told to go to the Song Garden, so I asked my dad if I could, and I could, so I went.  When I got there, only Ervin was there, and then Brittany showed up very close*time wise* behind me, and then Kyle showed up like 5 minutes later, how was he so slow?!?!?!?!?  So we sat and ate sum food, and by we I mean Kyle, Ervin, and me*Brittany didn't eat any, how come girls never want to eat around us....especially at the Song Garden?!?!?!?!*  I didn't finish all of mine because it was pretty spicy, so I got it put into tiny boxes and brought it home and my dad ate it for lunch today.  Either way, after we wre done eating there, we decided we didn't want to go home yet, so we drove over to Conor's and played ding-dong-ditch on him....except his doorbell didn't work...so we just hit it instead, and then we were walking and this SUV drove past us like 8 times just yelling things at us, then they drove past one last time, and Brittany and Ervin ran to the side of the road*pansies* and me and Kyle just stood there, oops, Kyle and I just stood there, and they just drove past, but then they jsut drove past and didn't do anything, then like 50 feet away they threw a cone out the window....so I went and picked it up.  Then another car came past and i threw the cone to the side so that they wouldn't see it.  Then I remembered that I had to piss really really bad, so I went and pissed off in the trees, meanwhile Kyle, Ervin, and Brittany just walked away.  Then when I was done, I went and grabbed the cone, and walked over to Kyle, Ervin, and Brittany, who were contemplating ding-dong-ditching Mr. Rohl.  I just took my cone and started walking back to Brittany's car, and this guy came out from this near-by house without a shirt, and when he got close to us he yelled ""Oh Shit!"" and ran away back to his house, and halfway there his phone fell of his buckle, and I yelled ""You dropped your phone!""  Then I continued to walk, and I was soon joined by Brittany and Kyle.  A while later Ervin came running after us and he had ding-dong-ditched Mr. Rohl, and it was all good.....then we got into the car, and were dropped off at our cars, and we drove home, and I slept....and then i woke up and went to my meeting, leaving me here, writing this......well....I've taken up enough of the internet, I'll go....PEACE-OUT!  Spense"
0SB3JU3,male,17,How to make a Lil_Metal_Mario        Ingredients:   3 parts intelligence  3 parts silliness  1 part energy        Method:  Add to a cocktail shaker and mix vigorously. Serve with a slice of lustfulness and a pinch of salt. Yum!        Username:       urlLink Personality cocktail  From  urlLink Go-Quiz.com
0SB3JU3,male,17,"I can see both of these working for me....odd.       Generate your Anime Style by  urlLink  Jena-su        Name:           Hair:    Dark and cut short.      Clothes:    Leather, belts, chains, bondage pants, collars, and tight shirts.      Powers:    Elemental control      Special Features:    Elf ears      Sidekick:    Large dragon.      Attitude:    Evil.  Just...Evil.      Weapon:    Nothing             Created with the ORIGINAL  urlLink  MemeGen  !            Generate your Anime Style by  urlLink  Jena-su        Name:           Hair:    In a style so odd, it defies all laws of physics.      Clothes:    School boy/girl uniform.      Powers:    Healing      Special Features:    Bunny ears and tail      Sidekick:    The great spirit of (insert character name of choice here), as channeled through whatever item you have onhand at the time.      Attitude:    Bouncy one minute, murderous the next.  No one knows when you're going to mood-swing next.      Weapon:    A sword that's twice as big as you are.             Created with the ORIGINAL  urlLink  MemeGen  !"
0SB3JU3,male,17,"TOMORROW IS THE BIG DAY!!!!!  YAY FOR ME!!!!  I luvded you choices, because choices means I get to go to Japan, and ROCK JAPAN TO THE HIZOUSE!!!   I'm so humble.... Hm...What was today like...uh....I was waiting for my classes to get over..I hope my teachers don't bitch at me for not doing homeworkey stuff....because only a few of them gave me stuff...oh well....I smell a lawsuit. gehehehehehehe Today is my last day in America for quite a while....c ya all later...or tonight if you're going to the Cat Fest....w00t!  I better get sum hugs or sutmhin'....PEACE!!!  Spense"
0SB3JU3,male,17,"I'm so bored.  I'm at Steve's, go figure, and I wanted to go to the MOA with my family, but they left without me...:-(  I desperately need sumthing to do, ANYTHING!!  pleeze...  So, if anyone has an idea of what to do, call me.  If you don't know my number, you probably shouldn't know it.  Spense"
0SB3JU3,male,17,"ALRIGHT!!! It's past my bedtime, but since I promised myself that I would write in this everyday, i'm going to write in it EVERYDAY DANGIT!!!  Hm...today was interesting, I started out by going to our choir thingy and singing first block, which was fun, but then I got uber pissed at sum stupid Sophomores for being morons*they shall not be named, because if you don't know who they are, you don't need to know*  Then I went to class for like 5 minutes....and then went to Mrs. Loneys for focus, and ended up being told to help her control student traffic for the choir thingy...and that she was gonna get us out of our classes all day*me and a few other people* and I was just fine with that, unfortunately, one of my teachers wasn't...that's where the trouble starts.  K, so I'm getting a D in Japanese*big frickin' deal* and so I'm not allowed to stay out of skool all day to help Mrs. Loney, instead, I have to go to Japanese and learn a bunch of worthless CRAP!!  So that made me angry, but before that I got to get hiy by a truck during second block, that was LOADS of fun...... Then the Chamber Choir sang, and we kicked major butt!  Then my dad took me and Ervin home, and I got to take the car and go to Ervin's, where I stayed for a while, and then Ervin took me and I got to go get a new Bionicle*which made me happy* but before that, what made me even MORE happy, was that I talked to Tina for quite sum time...and it was really kool to me.....MAN I LIKE DRIVING!! Then after that we went back to my house*me and Ervin* and ate dinner than went to Mutual, where we went to a jail, and it was really scary...the people were creepy there.  Then I got to hang out with sum hot chicks *apparently one of whose friends thinks I'm hot...which is pretty kool*  Then I drove Ervin home and I am here now talking to you people....this would have been longer and even MORE detailed....but I really gotta get my beauty sleep....PEACE!!!  Spense"
0SB3JU3,male,17,"I've signed in to this blog 4 times today, count 'em, 4! once around 1 A.M. once around 2 A.M. once this afternoon and now!  *falling wall* *Peter Parker/Spiderman jumps in the way, stopping it from crushing MJ* Peter:Hi. MJ:Hi. *period of silence* Peter:This wall is pretty heavy *more silence* Peter:Just in case we do die... MJ:You DO love me! Peter:Actually, I..LUV apple fritters.  Mm mm apple fritters.  Thank you Steven Pociengel for that comedy genius.  He said that during a fairly serious moment in the movie last night, and I couldn't stop laughing for like 4 minutes straight.  Oh god, it was so much more funny if you were there...and Steve said it to you.  Steve is a funny kid.  The funniest kid I know.  I'm glad that I know him.  I'm glad that I know MOST of the people who read my blog.  Sum of you I could live without.  Yet...for the most part, I can deal with most of you.  I'm TOTALLY bored out of my mind for the moment....everyone is at Karl's DDR Party having fun...you bastards.  Leaving me out....j/k.  You can laugh now.....pleeze laugh now?  Pwetty Pweeze wif a chewwy on top? *sad puppy face*  Fine then, don't laugh...ya big jerks.  Spense"
DBTRABH,male,26,"Have any of you been reading metafilter lately?  yowza!   the things in there are just orwellian nightmares... students being expelled for ""unpatriotic"" poems?  Teachers being fired for not pulling down anti patriotic posters or art?  What the hell is going on down south?  -- Jax, signing off."
DBTRABH,male,26,"well, I baught a pair of shorts last night.  cute little baby blue board shorts.  they look damn good.  :-)  Im so surprised and delighted they fit!  i went to wallmart, tried them on, and then baught them.  it wasnt a hunt for something that fit....  I didnt have to shop around, find a store that sells the ""big"" clothes, nor did i have to shop around these precious few stores for the best prices or what looks moderatly fashionable.    Its been such a pain, all the ""big"" clothes are like something farmer fred would wear. and the colours are bland, and well they are just horrible.  the freedom of just going to a great big store (and honestly, im anti mega store for ethical reasons)  but going to that store and just buying a pair of nice cute shorts was just the coolest thing!  ;-)  Well, this is jax signing off"
DBTRABH,male,26,"Ok, i did another weigh in...  I now weight 420pds!  woo hoo. lost 3 pds in 5 days.  which rocks  Also, im wearing my walmart pants.  they fit nice.  -- This is jax, signing off."
DBTRABH,male,26,"Well, im down to 395 pds. yay!!! yippee!!  now, the bad news, things are slowing down a tad. not really slowing down. but getting more difficult.  ive reached a spot that people dread.  the spot where my body likes to be weight wise.  now its well below what my goal is, and its not a good aesthetic weight.  SO I have to work a tad harder.  Right now whats typifying whats happening is a series of stalls.  Luckily Ive been responding well to carb loading when this happens.  The proces is to take a day and load up with carbs, and then go on induction the following week.  this usually gets the loss going again.  which is good.  After this hump things will go back to normal, but until then its carb loading/induction.  which i dont mind at all.  although a lot of the old food i used to eat I kinda find gross now. im going to have to see what i can do. -- Jax, signing off."
DBTRABH,male,26,"You know, over my boring summer Im thinking of doing something unique..  I want to either convert a car to run on vegetable oil, or I want to make a biodiesal maker.  It might be an opportunity to enhance my car technical abilities (currently a first level know nothing when it comes to cars.)  It would be a pretty neat project, and have real life effects on my community, and what not...  Hmm I think i shall research this more.    -- Jax, signing off."
DBTRABH,male,26,"Well, I have good news and bad news.  Im down the 417pds.  Thats the good news.  the bad news is that i had some cake today, and chocolate yesterday.  Now this isnt a major setback or anything... it just means im slowed down a bit. prolly have to go into induction again.  but thats no problem what so ever. the only thing is i didnt enjoy the cake.  makes me feel like i ate a bowl of flour.  yuck... i dont know why i ate it, my will power is usually much higher than that.  oh well :-)  At this rate getting to 200 by my birthday will be easy.  this diet is absoutely tailored to me.  -- This is jax, signing off."
DBTRABH,male,26,"Well, i doubt ive lost anything this week.  after my little pie adventure earlier in the week (mothers day)  i just started getting back into ketosis.  which is ok, but i have to be more careful about carb loading.     but ive been very good since, eating the things i usually eat. so i wont have to worry too much.  its a slow down, not a stop  -- This is jax, signing off."
DBTRABH,male,26,"Well, we have an update loyal listeners.  Allans going to be working MSN again...  groan.  Basically MSN's india offices ""cant handle"" the call flow and we are going to be working msn for the foreseeable future.  now what this has to do with Indias recent elections, leading to a coalition communist government have to do with this is a mystery to all but the most astute of my loyal listeners.  apparently call centres are fleeing from India like its the mutiny all over again. oh well, hi ho, hi ho, its off to work i go.  -- Jax, signing off."
DBTRABH,male,26,"You know, I've been thinking for awhile.  One of the things that is thrown in the faces of gays from the religious people is the ole nugget. Thou shalt not lie with mankind, as with womankind: it is abomination.  Now, what I've been thinking is that maybe its not so much to do with homophobia, but mysogany...  My train of thought comes from the fact that women were quite a bit less than men at that time.  It was almost as bad as women being livestock.  So basically if you look at the quote, especially since its surrounded with admonishments agains sleeping with the livestock..  Perhaps they meant not to lie with a man as woman, as in women are lesser, dont treat men as lesser?  Or something to that effect?   -- Jax, signing off."
DBTRABH,male,26,"Well. this blog is basically going to be a day to log of what happens here at work.  Now the reason this is of interest is that work is gonna be gone as of may 28th, (thank god)"
DS9R9BI,female,16,"Git = Gay Ignorant Twat Gimp = Gay Ignorant Man Pimp Mofo = Mentally Orally Fucked Object Snob = Sterile Nob Of Bastards Muffin = Mentally Unhinged Finger Fuckin Indecent Nob Ziggy = Zyborg Imprisones Girl Going Ya ya Keturah = Kinky Excentric Timeless Unforgetable Randy And Happy Hannah = Horny And Nuttily Naughty As Hell  hehehe dammit ziggy went offline so i had to finish the hannah one so it's a bit crap. today i rented Honey on DVD and it was great to watch jessica alba dance around in skimpy outfits :D  ahh gotta love ma momma she's cutting all my nails for me coz i'm retarded and cant do them coz i normally bite them, so now i have nice nails :) well sorta they just need to grow back a bit now  hmm i hope grant is drunk out of his mind, it's just makeing me turn towards women more and more, they way men are all acting right now. he defaced a pic of darin yevonde who is an absolute sex god, not good. *sigh* ok so maybe slight over reaction. hmmm.  god i loved the storm this morning at 6am i didnt open my eyes to see it but it woke me up like KABOOM!!!!!!!!!!!!  god it sounded like it was right over the house it was so kewl :D then tonight the storm was tip top too, thunder lightning and oodles of rain :D i wanted to go out in the rain but i missed it :( o well next time no matter what i'll b out there dancing in the storm yeah baby!  woop! louis has said he'll take me for a spin in his fucking lush mini!!!!!!!!!!!!!!! woop! got to love all my old skewl mates, i miss em loads right now. *sniffles* must arange a meet up with all of em. :)   i hope sexy tom comes to city tomorrow coz i need to buy that HIM tickit off him for ziggy, coz she's an absolute babe and deserves to go so much.   you hear me tom that tickit is for me to buy for ziggy kapish!"
DS9R9BI,female,16,"dont care if smileing is spelt wrong, so sue me.  ok was scared of work due to new till,it's all pretty cool now. Ryan is a cunt, i dont care if that's really harsh, he is an absolute cunt to me. i'm always nice to him and he's always an absolute bastard to me, who ever said ""never mix work and pleasure"" definatly got it right, i wish the whole staff room incident had never happened,yet i still like him and keep forgiving him, why do i do it? :( i gues i just love being hurt and laughed at and made fun of and all that shit. Ross on the other hand is an absolute dude. he gets a full thumbs up. he's easy to talk to and is really nice to me. like we can talk about everything musically we just love the same stuff, except he hates linkin park, i might be able to work on that lol, i doubt it. never mind, we've been to like all the same gigs it so rocks. so i went and bought him a Teen Spirit ticket so i have someone to go with, he says he'll pay me back so just for remembering value, he owes me £7.80. ok so that was work.  i told mom i was staying at hannah's last night, i was really at nathan's we were supposed to go to mark's but didnt. his step daddy got mad at us for falling asleep fully clothed in the sitting room. like how tite you wanna get, nothing was going on.  tonight i asked hannah if she'd have random sex with me. i think i shocked her just a tad. ..... ok so i shocked her alot but we r kewl. she said yes. we r still mates, i doubt the whole random sex would ever happen though so nathan needent feel threatned by hannah.she's my best friend after all.  i dunno what to do. maybe he'd just be better off without me. you know, coz we pretty much dislike eachothers taste in music and stuff, he should be with sarah, not me. Hannah says to be strong, but right now it feels like he'd be better off with out me, he's got his skateboarding and he's got sarah and all his friends. why does he need me when he's got that at his finger tips and i'm all the way over here.  nevermind  i need a shower."
DS9R9BI,female,16,":D ok so new fone almost here, it'll either be the same as hannah's or an upgrade to a better nokia :) but the nokia costs £10 more.  :( am worried about my baby, he goes into theatre tomorrow to have his cheekbone replaced, i wish i could be with him but school is a bitch, and i have to go to school. he knows how much i love him, ijust wish i could show t better by being there for him when he realy needs me. :(   i hope my stupid father remembers to bring rachels video to my work on wednesday. if he doesnt i will not be pleased.  *sighs* love him so god damn much, i know he'll be ok, i just worry about him"
DS9R9BI,female,16,"strange song for a subject title but it keeps running round in my head.  i hate kids, the kids i have to direct do not listen to me, they all need to be gagged and shut in a dark room, the fuckers.  i need to start writting songs again so that i don't sit there and imagine myself dead any more, when i get depressed, or go and do other stupid things. i need to start writting songs again, songs are better than the real thing.  ok guess you are probably wondering if there is something wrong with me in the head, and i'm sure there probably is."
DS9R9BI,female,16,"ok so up early again coz of stupid staff meeting, it bored me to death, plus ryan showed up i wanted to smack him well bad, coz of the mess he got me in last week.  oh yeah by the way i now have super sexy black hair! ;) yeah baby! i look good! ;)  hehe!ok now all sleepy due to my munching on bread pate and cheese, it wasn't supposed to be like a meal but i'm now full so i think my diet is going to pot. daniel called me classy totty coz of what i was eating, silly boy.  i went to real dad's after work meeting, was ok watched pocohontas2 and lion king (that film fricking rules!) and then fell asleep watching snow dogs then got woken up and made chocolate shapes with my youngest half sister, that was kewl though!   now i'm home feeling fat from the munch and i'm craving Nathan. i miss him so much, yet i know he doesnt miss me, coz he has loads on at the moment. just un-nerves me that i actually know he doesn't miss me. i dunno what to do. i want to see him yet i dont think he minds that i probably only see him once every 2 weeks. never mind, i just don't want to lose him, he's everything to me.  i need to write my french oral and learn it for thursday. i am so screwed. i am gonna fail coz i am shit at writing about single parent families in france in french! o why did i chose to do this subject? ok so i do know why i chose french but that's not the point. i just wish all my exams were over so i could get on with re-takes, if i have to take them, which i probably will.  oh well, i wish i hadnt eaten that pate tastes rank in my throat now."
DS9R9BI,female,16,"english lit exam went ok.  got many texts of crazy mark from whit camp which was nice.  man i feel shit, i've upset him and i didnt mean to damn my bouts of depression. i hate what i've done to upset him, i didnt mean it, i was just being the stroppy moody old cow that i am.of course i trust him, he should know that, shouldn't he? it's times like this when i feel like i'm losing him, that i know he's all i want and nothing else will do, i don't want to lose him, i need to work harder at our relationship, because i need him in my life more than anything.  fuck fuck fuck fuck fuck fuck fuck fuck fuck fuck fuck fuck.  what have i done? shit i dont want to lose him. i love him too much now to be hurt again because of my own stupidity, and incapeability to know what to do and say when in a relationship. i text him the most heartfelt text i have ever written in my life, and i dont know if he has any credit left to text me back or tell me to fuck off coz he doesnt want me, and that all my fears are right, he could do so much better than me so he is going to go and find someone who deserves him. coz right now i really dont deserve him. i dont deserve anyone. DAMMIT!  TEXT ME TEXT ME TEXT ME PLEASE!!!!!!  :) Matt wanted a mention on here so there you go Matt hunny there's your mention and yeah i know all this mess i have got myself in is my own fault for being an idiot, so you dont have to tell me.  *bashes head against the brick wall* maybe if i hit the imaginary wall hard enough with my imaginary head i'll knock myself out and go back in time and make all this right.  wish it was all that simple."
DS9R9BI,female,16,"THERE WILL BE A SPONGEBOB SQUARE PANTS MOVIE COMING SOON!!!!!!!!!!  how kewl is that huh?  me and nathan have been together 3 months today, i find that scarey, not that we've been together for 3 months, but because i find myself loving him more and more, yet i dont feel shy because of that, i just feel so at ease with him. mmmm *huggles nathan*  ok enough of the mushy stuff for those of you that are reading this and have just puked up in the nearest bin or toilet or sink. lol!  ok i must say this now, even though Ryan at work still picks on me sometimes, it's all in jest, but, now that he is single and has revealed he hasnt had sex for 2 months am quite worried coz he's a randy lil fucker, lol and way too flirty with me, but i am good, even when he spanks my arse tells me i have a firm ass and then suggests we go to the toilets to have a ""little feel around"" (the dirty sod) i tell him no because i love my boyfriend and that i dont want anyone else but him! ha! go me! but i  know ryan will find a beautiful girl somewhere else, screw her and probably end up with her or go and screw someone else, as is his nature, i'm sure. nah i shouldnt be mean to him, i know he's nice really and that he has feelings underneath the exterior, i'm sure.  anyways, i'm gonna be sickly sweet again and rant on again about how much i'm in love with my boyfriend Nathan, he's the best, he introduced me to HIM and my love of Ville Valo :) cant wait to see HIM in october with Nathan :)"
DS9R9BI,female,16,"yes this would be titled by lyrics of avril lavigne, that would be because i bought her new album today along with soil's new album and i got a free playlist cd too :) so it's all good!  i had to go to the dentist this morning for the first time in like a year :S it was scarey as hell. i found out the fillings my last dentist had done have ""buckled"" and need replacing, what a fucktard, aren't fillings supposed to last for forever? plus i had to have my teeth scaled, that fucking hurt. but it'll fo me good in the long run :)   back to work again for training on the new till system, it'll b well scarey when i come back in 2 weeks time to that new system :(  watched empire records again on dvd but fell sleep in the middle woke up and watched the end then watched the bits i missed in french with french subs so it classed as revision, then i watched mulan in french with french subs, so yeah french revison done yeah? hehehe!!!  i cant believe Amba said that to Brian last night, i really think he was offended but just covering it up. i did have a go but then she got uber upset so i had to take it back, i still totaly luv amba she's a fantastic mate, but she shouldnt have said that to Brian no matter what we were talking about, coz he means alot to me and i dont want to lose him as a friend again ever. *huggles Brian* *huggles Amba so she doesnt feel left out or like anything is her fault coz it isnt* right now i've sorted that out in my head it's all kewl i just hope he's ok.  :-D i can't wait to see Nathan tomorrow, i've missed him like crazy, spoke to him on fone coz he pranked me, and *sigh* he's just excelent and i love him, heart body mind and soul. sounds cheesey doesn't it, but i do, i just need to state it out loud coz i truely realised it the other day. i dont care that i'll have to share him with every one else tomorrow, i'll just love being with him, because when i am with him, it's like there is only me and him in the whole world and like nothing else matters at all except us being together. it's a most fantastic feeling *blushes* there's nothing else like it :)"
