X4JTJ1O,female,33,"I know I've already discussed my intense dislike of shopping with children in tow.  But for the sake of entertainment, let's review using yesterday as a prime example.  Yesterday morning began as any morning does around here:  Roman awoke at the crack of dark and I tried to persuade him into sleeping a little bit later.  My method is to lead by example.  While he lays there and babbles and pulls out my hair strand by strand, I doze in and out of an unfulfilling sleep.  What finally finally woke me up on this particular morning was a rather loud thud followed by a scared little boy's cry for his mama.  Yes, Roman is crawling now and crawled right out of the bed, did a double flip (I can only speculate on how he accomplished this) and landed flat on his face.  Good morning.  Reilly Kate woke up soon after and we proceeded downstairs for breakfast.  Much like Old Mother Hubbard, I went to my cupboard to give my poor girl some milk.  When I got there, the cupboard was bare and so the poor girl asked for some juice.  No juice.  Toast?  No bread.  Pancakes?  No mix.  Eggs?  None.  Nothing.  My poor girl got some dry Cheerios, an apple, and water.  She wasn't happy.  Time to go to the grocery store.  I began getting the kids and myself ready.  Never mind the fact that it was still just 6-ish and the store wouldn't open for another three hours.  I know how these things work and if I start the preparations early, I'll get to leave early.  No distractions.  Stay focused on the goal.  Heck, I figured, we'd be back for lunch and then do an afternoon pool break.  What a wonderful day I had planned.  Three loads of laundry, two baths, and a early morning nap followed by a major poopy blow out later, we were loaded up into the van  and ready to go.  It was ten o'clock.    As I drove through our pristine, brand new neighborhood I contemplate the recent rash of burglaries that is forcing us all to batten down the hatches.  This leads me to think about our own home and whether I actually accomplished the battening.  I couldn't remember if I'd hit the garage door button.  I racked my brain but came up blank.  I turned the van around to make sure.  Of course, the garage door was closed and I'd just made an extra turn around for nothing.  Better safe than sorry, though.  The time was then 10:05.    I head out of our development a little more hurried, trying to make up for those lost five minutes.  I sped up to three times the legal limit of 5 mph and out of no where something white hits my windshield.  I immediately thought it was a bird, but as I peered through it to view the road, I see that it is not a bird but a pair of panties.  Reilly Kate's panties.  When I was doing laundry I had put a pair on the hood of the van so as to remember to bring a spare pair for accidents.  I had forgotten all about them and with the additional speed, they flew off.    I rolled down the window and turned the windshield wipers on to try to catch them while driving.  It didn't work.  I'm no catcher.  They flew off and landed in the middle of the entrance to our complex.  I turned the van around and doubled back to pick up the panties.    With panties in hand, we were finally on the road.  The clock read 10:12.  I laughed to myself that is had taken me almost 15 minutes to get out of my housing development.  I laughed until I realized that I'd left my debit card and the grocery list sitting on the kitchen counter.  For the THIRD time, I pulled the van around and back we went.  This time a groundskeeper stopped weedwacking and waved at me.  I'm certain that the construction crew working on the last of the new houses must have thought I was lost.  I was frustrated and feeling foolish.  Back at the house, I left the car running and the kids safely buckled in their carseats as I popped in and grabbed the card and list.  Time of departure was now 10:18.    I put the van into reverse and then I heard, ""Mama!!  I need my donkey!""    Without uttering a word, I put it back into park, ran inside and upstairs into Reilly Kate's room, grabbed her donkey and ran back down.  I handed her the donkey, put the van back in reverse and sarcastically asked, ""Is there  ANYTHING  else we need before we go to the store?""  ""My sun gasses,"" (not a typo, that's how she says it, ""sungasses"") Reilly Kate replied quite matter of factly.  And since I had asked, there was no way I could have said no to her.  Back in park went the van.  Back inside went I.  I grabbed sunglasses and decided to make a quick check around the house for any other item that just might be needed.  Nope.  I was confident this time.  We were going to be on our way.  And we were.  The time was now 10:24.  Almost a full 4 hours from when I started getting us ready to leave the house.  Not bad, eh?"
X4JTJ1O,female,33,"My kids are breatharians.   urlLink Breatharians  don't believe in eating.  They think that they can exist on nothing but some kind of light they derive from air.  Hence the name: breatharians.  I'm quite certain my kids know nothing about this light from air business, but I'm just as sure that they are practicing this form of nourishing oneself.  How else would I explain the amount of poop exiting two bodies that nothing but air enters?  Tonight, I tried to employ the old reverse psychology technique recommended by my friend Dana to get Reilly to eat some broccoli.  The trick, according to Dana, is to get the toddler to think that broccoli is something special, not to be had by the toddler.  Liken it to candy even.  I made a big to-do about the broccoli.  I talked out loud to myself as I washed and cut it.    ""Mmmm... I love this stuff.  Broccoli is so good.  I like it almost as much as I like chocolate.  Yum.  I can't wait to eat this.""  I was smacking my lips and licking my chops.  Even I knew this technique would not work without a healthy, or rather UNhealthy dose of good, old fashioned, full fat, homemade ranch dressing.  I put out a big bowl of the artery clogging concoction on the coffee table, where we munch snacks while watching Animal Planet.  ""Don't touch this,"" I warned.  ""This is for Mama only.  You can have some cheese and crackers while I eat this with my broccoli.  Don't touch it, please.""  She didn't even look up from her beloved Crocodile Hunter (pronounced ""crock-a-doddle"" for those of you who don't know).  Steve was in the midst of getting bitten by a snake and Reilly Kate was enthralled.  ""Hmmm... I can't decide if I want some chocolate or some broccoli.  I think I will have the broccoli.  You can't have it, though.  It's not for you.  You just eat crackers.""   Still I got no response.  I sat down with a plate of broccoli, artistically presented in a pattern somewhat reminiscent of a star, and started noisily munching with the ranch as dip.  I was quite dramatic with my slurping and crunching and yummy yummy noises.  ""I know you shouldn't have this till you are at least six.  But today is a special day.  It won't hurt if you have just a little.  Would you like --""  ""NO!!!"" She didn't even let me finish.  I was cut off before I could even finish making my case.  Not to be deterred, I forged on.   ""Just as well.  It's not good for you anyway.  I just thought a little bite wouldn't really --""  ""No!!!""  She interrupted again.  ""I can't like that at all.""  She gets her ""can'ts"" and ""don'ts"" and ""won'ts"" mixed up.  ""I can't like that rrrrrrrright NOW!!!!""    She has picked up some of my speech habits.  I use ""right now"" quite often apparently.  As in ""Come here right now,"" and ""Put that down right now,"" and ""We're leaving right now.""  It gets reflected back to me and with the same tone of voice as well.  It's not flattering, let me tell you.  ""Just try a little piece.  It's better than chocolate.  Much better.  Mmmmm..."" I slowly wilting like a salad gone bad.  My ranch dressing ploy wasn't even working.  She had now put me on ""ignore.""  I sat silently crunching broccoli florets with ranch dressing as I contemplated my next move.  I waited till a commercial break and then I went and got her Easter candy off the kitchen counter and sat it down next to me.  ""I'll tell you what,"" I was about to make a deal with my two year old, ""You eat a few bites of this broccoli and you can have a piece of your chocolate.""  Her little ears perked up.  I had gotten her attention.  ""If not, I'll eat all the broccoli AND all the chocolate.""  And to prove I was serious, I popped a ranch drenched floret in my mouth along with a fat chunk of chocolate Easter bunny ear.  I clenched my lips into what I hoped looked like a deliriously happy smile rather than the repulsed sour puss the combination was eliciting.  Reilly Kate leaned over me, picked up two big broccoli pieces, dredged them through the ranch dressing bowl and held them up in front of her face.  Before I could even suggest she take smaller, bite sized pieces, she shoved them both in her mouth. She chewed and chewed as I sat and fretted over the choking possibilities posed by that large an amount of roughage.  When she finished chewing, she turned to me and announced, ""I did! Chocolate now, please.  May I please have my chocolate right now.  Rrrrriiiight NOW!!!""  ""One more piece and then you can have some chocolate.""  I was still wheeling and dealing, so I thought.  I extended a much smaller, toddler sized piece to her.  She again soaked it in the ranch and popped it in her mouth.  She chewed this piece for a much longer time.    ""Isn't it good?"" I asked as I crunched on some myself.  ""Isn't it as good as chocolate?""  ""Mmmm hmmmm,"" she agreed.  ""You can't have too much, though.  It's for Mama.""  I was still playing my game even if she didn't want to go along.  ""Mmmmm hmmmmm,"" she nodded and began looking at her Easter basket.  ""You want your chocolate now, huh?""  I needlessly asked and dug to find a nice small chocolate egg.  ""Mmmm hmmm.""  I handed her the chocolate and she merrily skipped away toward the kitchen.  I sat and watched Steve handle another snake on television while I grabbed some more of the green stuff.  I too was engrossed as I watched that crazy Crockadoddle Hunter take on a spitting cobra.  It was making my palms sweat.  Just as the cobra started hooding up to take a swipe at Steve, I hear the sinful sound of a toddler's delighted giggles coming from my kitchen.  I get up to take a look and this is what I see:  Reilly hunched over, as if she were puking, spitting out globules of gooey green sludge onto the floor where the awaiting Truman (our perpetually dieting dachshund) eagerly lapped them up.  It would seem that she hid the chewed up broccoli in her cheeks, fooling me with her bright smile and the ""Mmmm hmmm.""  I started to say something, but before I could even formulate a response, Reilly spat out all that was remaining in her mouth and shoveled in the chocolate.  Score one for the toddler.  She won that round. But I'll get her.  I'll get her tomorrow.  I'll fool her into eating eggs.  I'm going to hide them in a chocolate cake.  I have a recipe that calls for four large ones.  Roman's food refusal story tomorrow..."
WVESAHK,male,27,"I dedicate this Blog to my beloved wife, Marta Sol de Escalante Arce, who so heroically endured the criminal act of my kidnapping, and whose virtuous devotion served as an inpsiration to me in my spiritual and physical recovery.  I also dedicate this book to relatives and friends who demonstrated such a noble interest in my safe release.  To all, my deepest gratitude,   Luis Escalante Arce"
WVESAHK,male,27,10:49 PM recomfortados por la guitarra de Paul Simon y la tradicional flauta Andina que le pone sabor a su musica.  Es un momento tan lleno de satisfaccion que deso compartir porque la seccion de BARES de Morolongo ha sido completada en su totalidad. En tonos de anaranjado y rojo con imagens de Martinis y llamas en la parte de atras condecoradas por un poderoso flash que le da el toque final a la seccion le ponen la estampa de oro al primer portal Salvadoreno que pasra a la historia haciendo sonar al publico internacional por la calidad en diseno y en programacion que dicho sitio ofrece.  Justo cuando termino de escribir este parrafo empieza a sonar el fabuloso exito de Lou Reed y Velvet Underground titulado 'Perfect Day' ..........  Saludos...........
WVESAHK,male,27,"March 6, 1982   His Excellency, Ronald Reagann The President of the United States of America The White House Washington, D.C.  Dear Mr. President,  When the Spanish author Vicente Basco Ibañez landed for the first time at the port of New York, he enthusiastically exclaimed: ¨The United States is the Youth and the Hope of the World¨.  Mr. Reagan, your election as President has served to revive that feeling.  In your eloquent and clear-sighted speech delivered before the Organization of the American States, a speech which bears the stamp of your personality, you have set forth--given the Communist menace facing the Third World the geographical importance of Central America and the Caribbean to the social and political future of the American Hemisphere.  The Carter administration in its foreign policy set a match to the Central American isthmus and induced countries such as El Salvador to violate their constitutions. El Salvador is notable for its guarantees of right to private property.  Unquestionably, the political, social, and economic restoration of Central America requires a climate  of peace and tranquility, which can come only with the disappearance of Soviet-Cuban penetration, operating from the platform of Nicaragua.  El Salvador, the smallest of Central American countries, is outstanding in its vigorous industriousness. Despite bad military governments since 1960, the initiative and dedication to hard work of its private enterprise has enabled the country to offset the inefficiency and many failings of those governments.  But factions with Sooviet-Cuban ideology, made up mostly of university students, Jesuits, a few military men disguising as ¨Liberals¨, funded by the proceeds of kidnappings and bank robberies, not disuaded by the progress and production increases achieved by the country, irresponsibly set about promoting anarchy. Successive national governments, specially that of General Romero, tolerated their terrorism with the excuse that they feared being mistakenly said to violate ¨human rights¨-- the false banner waived to such good effect by the communists.  With the regrettable approval of the U.S. Ambassador, Mr. Frank Devine, the coup d´etat of October 15, 1979 was staged. Brandishing an Army proclamation, in fact drafted at ¨UCA¨, the Jesuit university, the present government, styling itself the Revolutionary Governing Junta, proceeded demagogically and without calculating the economic consequences, to promulgate laws imposing: a)Agrarian Reform b)Nationalization of the Country´s private banks c)Nationalization of the Export of Coffee, Sugar, and other key products.  In your brilliant speech, Mr. President, you mentioned that in El Salvador there has been an ¨agrarian reform without precedent.¨ It was indeed without precedent in that it consisted of the confiscation by military force of rural properties that were achieving the highest yields by reason of their exemplary cultivation. That was also what Fidel Castro did at the outset, foreshadowing the nature of his rule.  I wrote a long and informative letter about the agrarian reform some time ago to the honorable Congressman of the State of Maryland, Mr. Clarence D. Long; for your convenience, I attach a copy of this letter.  With regard to the nationalization of Salvadorean private banks, one asks oneself what would have been gained in the United States by the nationalization of the Bank of America, Citibank, Chase Manhattan and so on? In the banking field, what was in fact needed in El Salvador was a reorganization of the Central Bank (Banco Central de Reserva), which since the year 1961 has been directly subordinate to the President of the Republic, an arrangement which clearly iss not constructive for a free economic system.  The nationalization of exporting has served to displace qualified exporters, making way for incompetence and corruption in the bureaucratic offices put in charge of these activities.  In sum, the results of the aformentioned reforms imposed by brute force have been: a)Reduced agricultural production b)Poor administration of Bank Credit c)Drastic reduction of international monetary reserves  It was encouraging to hear in your speech your affirmation that freedom is our common destiny. This is undoubtedly the noblest of all causes. This is why I consider it opportune to add that:  The guarantee of private property is what mosst strenghtens the liberty of man. Where this does not exisst, as it does not exist in communist countries, there disssapears the freedoms of expresion, religion, press, and all of mankind´s liberties; discouragement prevails.  I remain, Mr. President, with esteem, admiration and respect.  Luis Escalante Arce Founder Banco Agricola Comercial"
WVESAHK,male,27,"Antes de ir a dormir, y haciendo de mi vida un Truman Show con los BLOGS destaco lo siguiente:  Acepto que mi cualidad/debilidad mas destacable es mi sarcasmo. Quisiera que fuera algo mas, pero al final agradezco que soy sarcastico y no un snob, geek, narc, o algo asi.   No se si los defectos de caracter se forman a traves del tiempo, pero segun me explicaba alguien el otro dia la personalidad de una persona esta completamente desarrollada a la edad de 7-8.  Bueno para no entrar tanto en detalle, si recuerdo de manera explicita la primera vez que sembre polemica a nivel de padres de familia. Nunca fui muy reservado pero este comentario marco el principio de la persona que soy ahora, ""Hecho mierda"" como decimos.  Recuerdo que celebraba mi cumpleanos no. 11 en la casa de mis abuelos Escalante y mi familia me habia preparado una bonita fiesta con todo lo que se puede esperar que estimule la ilusion de un nino. Ya me advertian que era un adolescente pero supongo que era para que me portara mejor! Y mi abuelo Luis ya me habia regalado por segunda vez el libro: Como Ganar Amigos e Influenciar a Las Personas de Dale Carnegie, el cual no he leido aun.  Recuerdo que el dia de la fiesta habiamos terminado de corretear por el jardin jugando Ladron Librado y 1,2,3 para mi y los invitados y companeros de clase seguian llegando a mi fiesta.   Aproveche para comerme unos panesillos sin orilla con jamon y queso con un vasito de orchata cuando decidi ir a la entrada de la casa para recibir a algunas visitas. Al menos eso pretendia yo con este gesto! A distancia logre identificar junto a su papa a un companero Jose Roberto Samour quien venia entrando con un regalo en forma de cilindro cubierto con papel y una enorme chonga. Yo me acorde que Jose Roberto anteriormente le habia regalado un basurero de G.I. Joe a otro buen amigo para su cumpleanos y que ahora se repetia conmigo.  Pues cuando se acerco a mi con su papa Don Roberto Samour, en vez de decirle muchas gracias por acordarte de mi o algo nice, decidi responder asi:  Puya, vos solo basureros regalas men!    Fue tan polemico pero tan gracioso ese momento que mi papa quien se encontraba a mi lado se tiro a reir a carcajadas.  Buenas noches a todos......."
WVESAHK,male,27,"Pa pa ra pa pa eueu.............  Morolongo esta llegando a su etapa final antes de ser lanzado.  Con una gran emocion y dos tazas de consome de garrobo adentro espero con ansias este gran fruto que ayudara al desarrollo del micro empresario y contribuira a la estimulacion del turismo.   He tratado de compartir con una serie de economistas la vision que tenemos en Morolongo y pocos la entienden porque nadie lo ha hecho en El Salvador. Me encuentro siempre ante un grupo de economistas que me preguntan porque? y entran en un analisis automatico de costos vs. beneficios....... gracias por sus consejos senores. Su analisis es muy interesante (no quiero decir que con esto que no me interesa hablar con uds), sino felicitarles por siempre hacer un efectivo analisis y preguntarles: Hasta donde analizaran un caso y cuando se tomaran el riego de ser emprendedores?  Que era un Google o un Yahoo antes? Preparense para hacer uso de la palabra Morolongo en su vocabulario de cada dia en los proximos meses.  Saludos,  Luis V. 3:15 am (Hora pico para pensar bien)"
WVESAHK,male,27,"I have decided to issue this Second Salvadorean edition of ¨Human Attrocities Against Human Rights,¨ in responsse to the appeal of many of my friends, both in El Salvador and in other countries, that I do so. In this latest edition, I sset out to describe not only my own ordeal, but also the tragic tales of other kidnap victims in El Salvador, many of whom never lived to tell their own stories.  The reader will learn about the torment and indignities inflicted upon innocent victims by terrorist predators, and the overwhelmingly silent reaction of the authorities. If nothing else, we ough never to forget the names of the victims whose last moments are recorded in this book; we owe them at least that much."
WVESAHK,male,27,"Una biblioteca es un hospital para el espiritu...   Yo Digo:  La Musica es como un masaje relajante!  No se que quiera decir yo con ello, pero si quiero hacer referencia a la pelicula ¨White Men Can´t Jump¨ adonde Wesley le dice a Woody: Hermano tienes que aprender a escuchar la musica y no simplemente a oirla.  Voy a tratar de saltarme la parte adonde entro yo como escritor y digo ¨YO CREO¨.........  Solo quiero recomendar esl sitio http://www.allmusic.com un verdadero manjar para concocer todo acerca de la musica y los musicos. Los diferentes estilos e influencias que los llevaron a componer obras maestras que hoy en dia nos acarician la memoria a tal grado que atraves del tiempo siembran un episodio nostalgico en el cerebelo que se rebusca por ser recomfortado a diario recurriendo a pensamientos creativos para romper la rutina y la estructura que todo ser humano cree que debe de tener.....  Realmente ante un estereo lo tengo todo: Memorias, Incidentes, Senior Year, Elementary , Love, Peace and Imagination. Pero que hago con tanta informacion que de repente pasa enfrente de mis ojos y me hacen recordar lo malo, lo bueno, y lo feyo........creo que es aqui adonde quiero llegar.   Hay que darse un par de minutos para reir, llorar, descansar, y proponerse objetivos concretos para llegar a cumplir el proceso de realizacion humano.  Ahora si tengo ganas de escribir.....hace un momento me sentia bloqueado. NO SE! Ahorita escucho ¨SMALL TOWN¨ de John Mellencamp y nada mas me acuerdo de Larry Bird (uno de mis idolos creciendo) y la cancion que marcaba su trayecto desde French Lick, Indiana hasta  Boston, MA. Un momento magico en mi vida en el cual yo veia los partidos de la NBA con mi papa y sus amigos y me recuerdo una vez que mi mama me regalo un libro de Larry Bird. Mi primer libro por el cual yo me esforze por leer y aprendi mucho de el (Gracias!!!!!).  De ahi tuve muy claro que queria formar un equipo de basketball integrado por amigos cercanos y fue cuando Frederic, TAKI, Paco Chico, YO, El Chino Reyes, y otros formamos un equipo llamado los Atlanta Hawks para competir en el juvenil del CDI: El cual terminamoss ganando.  Volviendo al musicon...............uno va viajando y conociendo a sus leyendas. Ahorita estoy escuchando Bruce Springsteen quien tuve la oportunidad de ver en Orlando y su energia y entrega me impactaron de manera que ahorita considero que no es un buen momento para parar de escribir. Recuerdo muy bien a una chera con quien yo baile en el concierto cuando Bruce se subio al piano y empezo a pedirle a la gente que se entregaran a las vibras producidas por la banda quien emitia un eco fuertisimo. Pero lo mejor era compartir un momento intimo con una chera excepcional por quien en ese momento me sentia poseido...........  Bueno...........creo como dice toda persona sabia ¨ No hay que servirse tanto de lo mismo porque se puede empachar uno¨  Dejo mi BLOGGING hasta aqui y les digo en los momentos mas dificles es para darse un baño en musicon.........llorar, reir, y amar, es la esencia de todo."
