V0ZIU4L,female,27,"On my Mind     I made muffins from this instant just add water mix, and I am trying to figure out why they are so darn small!! They look like little buttons where muffins should be!!     Something Amusing To Me     Ice is a food and like any food, it can go ""bad."" Every food code in the U.S. and Canada defines ice as food. We eat more ice than we do bread, nearly a hundred million tons a year or about two pounds per person per day.   Oh, believe you me, this is totally true! I have had ice in the freezer, and had it come out tasting like … well… freezer!! Especially awful when you want to make a daiquiri!!     Crap of the day     Okay, I am going to let you In on a little secret. I actually type my posts a little bit at a time. I usually start off in the morning posting a complete post, and then taking my crafty “Blog Template” that I made In MS Office “©” and start a new one. From there I usually get the word of the day and the amusing sections done. Then I do what ever I do In the day, and when ever something strikes me as something to squawk about, I type It down. I know, It’s sorta like cheating… but I have no time to just sit and type all this stuff all In one shot!! Anyways, so you know, most of my posts end up speaking about the previous daily events because of this. Just FYI.   Kira got up at 6 am today (yesterday, bwwaahhhaaa) and was really pissy. I think she realized that we have now tampered with her sleeping until 9 am, and she Is just plain mad. I was too when I was little and my mommy used to kick my but out of bed, then realize I was actually awake long before then anyways.  I digress, so Kira wakes up and Is screeching her lungs out, a first time thing for all of us to experience. You know what Mark does? He nudges me on the shoulder and says “ you gonna get that?”!!!! I almost died. Of course I was going to go see to her, but STILL. So I went and got her out of her crib, brought her to bed (which I never do), and plunked her down by her father. He looked at me all horrified, and I just calmly said “Good morning hun, I am going to go make her a bottle and go pee, your turn!” Well, that was one of the funniest moments in my life!! He realized that he was being an ass and apologized to me after I got out of the bathroom. He also changed her diaper and calmed her down, so It’s all good… but I sure had a laugh at his expense this morning!   The dog Is really beginning to just Irritate the living shit out of me. Seriously. That dog has to like, go get a job or something!! She Is normally really good around Kira, and around the rules of the house with begging and where to be during diner and all that jazz. But lately she has taken It upon herself to REVISE the rules to her liking. I can tell you she is this close to death. She doesn’t do this to me (because she knows I would kill her), but she waits for Mark to come home and eat diner and BEGS. She sits there, all pathetic In full out begging mode. Mark could care less, he Is so hungry by the time he gets home, but me on the other hand. I get so mad at her, and yell at her to get the “hell down the hallway now or you will be my next pair of mukluks!!” I think she might turn Into a fashion don’t, she had better be careful.   Well Mark did me a huge favor last night, he installed MS Office on my computer (yay!), but In doing so It made my Sims just vanish off my desktop. I haven’t the slightest Idea why that happened, all I know Is I have to start from scratch now.. and I think I am happy about this! At first I was REALLY pissed off, and 10 kinds of nasty… but I re-installed It and It Is so fresh! So new!  I started playing It again today and ENJOYED It!! I haven’t had this basic a game In months, so I am happy now. Well, happy as one can get..lol.   I wanted the office program so that I can keep count of how many words I type, but I must have It all set up wrong or something. I just have this bar that tells me how many words are In each paragraph. So I am going to have to fix that. It also adds spaces, and I don’t think you should get credit for pressing the space bar, unless you are habitually running words together, In that case you deserve a fucking metal!! You know what I could REALLY do without? That damn paper clip. That thing Is really getting on my nerves. Really really.  I do like the instant spell checker thingy and the grammar thingy.  That helps me lots, because… you know, I have no writing skills at all and still managed to graduate from high school and go to college. * grins *  Oh wait.. I just figured It all out!! It’s a separate thing you have to look for .. eish, like talk about work!!!     The Silver Lining     I am happy with my Sim’s game… and I am making spaghetti for supper.  That’s about all I got today.     Word of the Day       aerie or eyrie      \EYE-ree\, noun:        1.  The bird's nest built on a lofty place, such as a cliff or   mountaintop.   2. A dwelling or stronghold located in a lofty place.   Mercedes Lackey always has great books involving Gryphons. Gryphons are typically found dwelling In AERIES."
V0ZIU4L,female,27,"On my Mind    I want to know why my hand hurts. I have this searing pain running up between my index and middle finger on my left hand. I don’t do anything strenuous (not with my hands) and I don’t remember hurting It…  Maybe It Is just on strike from having to pour coffee Instead of typing!! Evil brain telling hand to serve…noooo…    Crap of the day    I was a little bored from Kira being sick and sleepy… so I started looking at the real estate around here. There are a few deals that Mark and I are going to look Into. I really really really want my own house. I know I have stressed this point enough, but I would just like to be IN a place that was 100% mine. Well of course It would be Marks too… but lets face It, not like the guy will come shopping for throw pillows.  Looking at a few other options too, like moving Into the city, which I don’t know If that will happen or not. So Mark Is going to have a chat with is boss, see what his options are, and go from there. But looking at real estate can’t hurt right?? lol…  Like I said, Kira was sick and sleepy, so I was really bored. I couldn’t clean (to loud) I couldn’t watch TV (nothing on anyways) I couldn’t read (my eyes are too sore), so I basically surfed the web and flipped through magazines until she woke up. Fun fun.  I also did something I know I should never do, I watched Oprah. I should always just pass It by, but NNOOO, had to sit there and watch these poor women tell their stories of terror as their ex-husbands shot their children and now just want to die. I always get upset and cry and hold Kira till she fusses and squiggles her way free of the crazy lady sitting where her mom used to be. So now there Is this combination of Insane parent and bored parent trying to figure out what to do with her child. I am pretty sure only booze at this point could make matters worse for poor Kira. Do you know what I hate to do more than anything else In this world?? Wait. I have to wait all the time, and I realize that just life blah blah blah… but I’m seriously not liking It. So you are asking yourself ‘why does she care all of a sudden If she has to wait for anything?’… well I’ll tell ya: there Is a parcel In the mail. Mark went to go and pick It up. It’s a box that Is full of books I have wanted to read, and Dave finally sent them to me. And so now I have to wait and wait AND WAIT until Mark feels he has tortured me enough, comes home, and lets me crack new spines In glee. I have no patients, and I am not very virtuous, so I go a little nuts waiting for things. I get overly excited and anxious and then tired from expending so much energy moving around like a crazed lunatic, scrubbing counters and bugging the shit out of the dog. Just a mental note, I don’t know why I always say “crazed lunatic”, one would think that a lunatic was crazed so there for Is a redundant statement… I need help.  Mark and I got to have lunch together for the first time In … well.. I honestly don’t remember when the last time we had lunch was. We has BLT’s which were very yummy, and I think I will cook something for super too since I have all this free time that normally gets soaked up by work *ugh*. Maybe chicken fajita’s. I make these deadly fajita’s, with red, yellow and green peppers, chicken (duh) and sweet onion. Tossed In my secret fajita sauce (old el paso packet hehe) and wrapped with cheddar cheese and salsa In a warm tortilla… *drool*… ya, we be havin’ those for dinner!! Of course I could take a picture of these and make you drool too.. but I am mean, and If you want to know what the taste like or look like, well you are more than welcome to come for dinner. HA.  There Is a god damn fly buzzing around here and just generally annoying the crap out of me. That stupid thing had either a) DIE or b) get out of my house! I am buying a fly swatter today, and I will remember to squash It like.. well like a bug. The bugs now seem like they are IN hoards and swarm over me all the time. I remember thinking that the bugs were never that bad unless you went to Long Lake (then the horse flies would eat you alive) or camping IN the bush (those are some seriously nasty bugs). Now It just seems like they are there ALL THE TIME…. I hate summer.  I have done nothing with my diet/exercise lately. I suck. I still go to Curves ® but I missed a day last week from being so sore, and this week I am determined to go the three times. But I have been eating terribly and thus far have gained back 7 pounds. I know, don’t get down, just pick back up and start a fresh. I was doing so well though, then I got all stressed out from the work, daycare, driving things and all of a sudden I am back Into the same old routine eating that got me to this weight In the first place. And I saw It coming, and didn’t do a damn thing to prevent It. But on another note, I like Tim Horton’s cake donuts since they started baking them *grin*. Yep, I suck. Oh well, I will try again here soon… notice the hesitation and no definitive planning.. lol.    The Silver Lining    Well, Jace Is on the block and Marissa got the shaft. At least reality TV Is going my way...!!    Something Amusing To Me    ""Life is a sexually transmitted disease and the mortality rate is one hundred percent."" ~RD Laing.  Just plain true. Especially If you look around you and see the things that pass as human doing their daily drudge."
V0ZIU4L,female,27,"On my Mind     My weather pixie isn't working properly. I am not sure If It Is a problem related to their site or this blogger site. As It stands, Brian had a good deal of trouble getting In to read my page yesterday, and today I had the same problems. But I think It Is the actual Pixie page, seems to be wonky.   I am also thinking of another revision for my page. I am not sure what this will entail, but I think It will work out for the better. I am considering ditching the word of the day (I like It, but I get It In my e-mail so I don't know If you all like It), and maybe the amusing section. I mean If I find something amusing I might add It later, but I don't know, I sorta think Its neat. We'll see what happens.      Something Amusing To Me     Factoid:  The color combination with the strongest visual impact is black on yellow. Next to follow black on white, yellow on black, white on black, dark blue on white, and white on dark blue.   Hmmm, well my Header Is white on dark blue, and my main text Is white on darker blue, and I find It easier to read and more pleasant than my previous page Of purple on black. But who knows, this could all just depend on the reader right?? Then again, I always see a bumblebee and hardly ever see mosquito's coming.     Crap of the day     Only four more days of freedom left. This sucks so bad I have no words. I am hoping for a long shot here and maybe a winning lottery number. * Sigh * I suppose It will all be okay In the end. Right now our main concern Is all the driving and scheduling to make sure Kira and I are able to get home. Mark works ungodly hours (have I mentioned that?? lol) and I have no license yet, so we have to try and make a game plan to go by. As It stands we are okay In the morning leaving at 6:30 to drop Kira off at daycare, get me to work by 7 and he goes to work after me. BUT coming home Is a bit tough. I think next week might be a okay because I will go to curves after work all four days, but usually I only go three times a week, and that Is all you are suppose to go, but I missed once this week.  But after that, I don't know If It will all be good. Mark figures he will end up doing his bin work and paperwork after twoish because that is usually when he gets done his calls in town. Then he will have to do other work until I get off of work to get Kira and drive us home. This Is just such a drag, I actually can't wait to have my own license now.   I don't know If you all know about my Better Business Bureau claim, but I just got a letter In the mail about It and apparently for them to get my money back and file a complete claim, they have to be able to contact the business I am complaining about. Obviously, right? Well the damn business doesn't have a legitimate fucking address or phone number!!! I am so pissed off, now I have to try and track all this shit down and I am having a lot of problems with It. SOOO, in the efforts that maybe you guys can help this Is all the Info: The company name is Clerical Gear (clericalgear.com DON'T go there, just telling you), the owners of the business are Judy & Troy Ellis and as far as I know they had there businesses set up In Boston, and Newtown PA. This Is all I have. I have tried getting the address and whatnot from them, but like they are going to give It to me so I can file a complaint about them. Anyways, just to reiterate, everything on-line work related Is a total, utter, complete SCAM and no one at any time should EVER give them any amount of time or money!! * ahem * that being said, happy surfing.   I have a huge mess In the kitchen to clean today. I made muffins and cookies and two dinners, and haven't cleaned up at all!! I know, that is so bad, but hey, I just wanted to eat not clean!! Mark was a good boy today and did most of the dishes and loaded the dishwasher, so all I have left Is the cookie sheets, pre-soaked muffin tin and a bowl, plus just wiping counters and sweep/mop the floor. So actually It Isn't a HUGE mess anymore, but a mess that I am avoiding anyways. I also should at some point get up stairs and sweep/mop the floors up there. We have laminate up there and I  always forget to quickly bring up the mop and do a quick swipe. So the upstairs doesn't get much love from the mop, which Isn't to bad because It Is laminate and shouldn't be wet, and we only go up to sleep so It's not In a high traffic area. Still though, need to remember It.   Talking with  urlLink Kaye  on messenger today she pointed out that I capitalize all my ""I's"" . I had no Idea that I did this, so I looked back at all my posts, and sure enough I do!! It's like a sickness! You don't have to capitalize them all, I just do. Somewhere I must have picked up this notion that you HAD to, and so I just got Into the habit of doing It.  But now I am OVERLY conscience of this, and capitalizing even though I know I don't have to, and I am going crazy!! So, I have decided that I just don't care, and I like my capital ""I's"". SO there!! TTHHHPPPTTT!!!   Mark and I were talking about projects that still need to be done to fix up this house, and we were talking about not painting until the winter and instead putting up a new fence. The one we have now was make shifted from materials from our old deck, so It Is an eye sore. Plus we hate our neighbors and their fucking dandelion infested lawn, so It would be nice to have a big tall fence to separate. I agree with all this totally, but given that there Is only what, four more weeks of summer (well not really but you get It) we don't have that much time. Plus with the new daycare expense we are set back just a tad for the initial down payment (first and last months fees) . We aren't broke, but I don't think we have the cash for a fence, It's a little expensive and we still need gas for the truck and food for our bellies. I haven't a clue, we will do what ever.   Evil MS Office.. It has slyly changed the annoying paperclip to a cute little doggy, I'm on to you Gates...!!!!     The Silver Lining     I know this might sound so 50's, but I made cookies and they turned out perfect! The nice consistency of chips to batter and smooshy center to crunchy bottoms!! Oh, I made chocolate chip cookies after the disastrous peanut butter cookie fiasco (which I haven't mentioned, I just burnt half the mix is all).     Word of the Day       ensorcell or ensorcel   \en-SOR-suhl\, transitive verb:    To enchant; to bewitch.    All of a sudden Mark was clucking like a chicken! The lady had him hypnotized, though he says she must have rolled a natural twenty to ENSORCELL him with a charm spell.     Bonus Setion           I have been playing around with the HTML coding and now I have figured out these nifty symbols and stuff! So of course you will all be subjected to seeing them In more of my posts... bwwaahhhaaa!!!  Ψ   Ω   Φ          IF YOU HAVEN'T WATCHED BIG BROTHER, DO NOT READ THIS!!! SPOILER!!!    Okay, now that being said OH MY GOD!!! You know what, I was really hoping Adria would make It this week and thank the gods she did, but If I would have realized that Holly was going to end up talking for that LONG afterwards, I would have just walked away!!!! She Is SOOO annoying! If I were any of the house guests I would have evicted her a LLOOONNGGG time ago!!!!    IF YOU HAVEN'T WATCHED NIP/TUCK, DO NOT READ THIS!! SPOILER!!    Could that kid Matt look anymore like Michael Jackson??  Seriously sickening, he has the eyes, the nose, the mouth, the fake white look (hehe)  everything but the eyebrows, I have no Idea which parent contributed to those bushy bad boys, but thank the gods because that Is probably the only thing they can Identify with!! Ugly guy that one, and what the hell is with Christians hair? Way to short and not playful at all. He Is still totally hot though * wink * . Can you believe this turn around though?? The whole thing with that chick who plays Jean Grey on X-men Is just sicko. And the whole sperm donation from Christian to Liz, WOW, talk about your monumental disasters!!"
V0ZIU4L,female,27,"On my Mind     Just wondering what I should be doing today, I cleaned up so well yesterday I have bleach marks on my hands... That can't be good...     Something Amusing To Me     The ""you are here arrow"" on a map is called the IDEO locator.  I always wondered If that thing had a specified name..lol.     Crap of the day     It was HOT here yesterday. Too hot, I hate summer, have I mentioned that before?? I know some people think I am completely nuts, but I love Fall. I love that In Alberta. There are four distinct seasons, and Fall is perfect. It Is pretty and cool and wistful... Great weather for a light sweater or pull over. That to me is perfect weather, nice enough that you don't need a coat, cool enough that your skin won't scorch under the sun. I can't wait for Fall. Banish all those tanned people back to the white and pasty bwwaahhhaaaa!!!   We were also on tornado watch yesterday *joy*. It was totally not breezy at all until about ten o'clock last night, then It was like a huge storm was passing thru. SO of course we check out  urlLink weather Canada stats , and sure enough we get this warning:    Severe thunderstorm warning    A severe storm has developed, producing one or more of the following conditions: heavy rain, damaging winds, hail of at least 20 mm in diameter or intense lightning. Severe thunderstorms may also produce tornadoes. The storms expected motion and developments will be given in the warning. If you are in the area specified, take shelter indoors.    Tornado watch    Conditions are favorable for the development of tornadoes within the areas and times specified in the watch. Be prepared to take shelter, preferably in the lower level of a sturdy building.  We just love that here... I so want to see fall...   Ken was mowing the lawn yesterday, and it is the first time in awhile that the front lawn has been cut (it doesn't grow as fast as the back yard), so inevitably there were some nature of funky weeds that I happened to be allergic to, and the windows were open. So now my eyes are all puffy and red and my nose is runny. Fabulous. I hope Kira doesn't get the same bout in allergies that I seem to have... All stupid stuff that is air bourn. Well that;s not all, but those are the most annoying. Not like you can ask mother nature to give you your air with ""no pollen please"". Grr. Well at least I know the summer is getting closer to ending from the blooms.   I have no ideas about what I am going to do today. I know I should go for a walk with Kira and check the mail... But we will see how hot it is today. I should also get my laundry done (well as done as laundry can get), and probably should try to clean out my fridge and go grocery shopping. The fridge Is another thing I hate doing... *people* keep putting back half drank pop that spill and never get used, and t-bone steaks that the dog is never allowed to have yet they will never eat the damn things. I just think It Is all a big waste. I have things In little containers, and I use them up... Maybe that Is the difference between growing up to appretiate your food.     The Silver Lining     Once again, no tornados!!! Also, Kira is taking steps all on her own now!! She stands really well on her own, and now she is taking one step away from stuff, then one step back (because it's scary and you can't go to far!)!! I am so proud of her!     Word of the Day      nescience   NESH-(ee-)uhn(t)s), noun:   Lack of knowledge; ignorance   Upon the questions of his students, the professor went on in a NESCIENCE of words."
V0ZIU4L,female,27,"Okay, just so you all know, I will update later In the afternoon, as I am WORKING *grrr*. But I promise I will have a butload to say later!!! MMMWWWAAAA!!!!!!!!!!"
MMSPFVE,male,23,"Today me and Badri came up with this universal ABBA code, which can remove the Blogger Banner completely from any template !!! All u need to do is, just put following peice of code in your template right after the    <style type=""text/css""> line.    /*  *  by : Parikshit & Badri *  to : Add Block to Block Ad in Blogger.com !!! */div {display:none}#wrapper {display:block}#wrapper div {display:block}/*Following lines fix the IE margin bug */#wrapper div#sidebar-wrapper {display: inline}#wrapper div#main-content {display: inline}"
MMSPFVE,male,23,"More on food. Weekend Shopping!! And this time we went to  The Forum , the new ""Mega"" Shopping mall at Kormangla. Wedding gifts? Some friends had given gift vouchers for  Landmark  and  Westside , so it was time to redeem them before they would become invalid. Kalpana was busy getting goodies for herself and some cute things for the house. Poor me, she did not buy me anything. Anyhow, once all the shopping was done, it was time to hog and the perfect place for a quick bite was "" Transit "", the food court at  The Forum .  This place is awesome, the look and feel gives you an impression as if you are in some Bond movie, the food is not bad either. This time though we had a bite of the Thai food at the "" Panda Club "".  Chicken Satay , kind of a Thai version of Chicken Tandoori though the size was a hundred times smaller. I had a Thai combo non-veggie meal while Kalpana went for the Vietnamese Combo veg meal which she did not like one bit. So, I had to swap my plate with her in the anticipation that she does not throw up. What can I say, she has peculiar tastes :) But I had a good time and I really feel the food court is done well, a thousand times better than the one at Kemp Fort.  Highly recommended for a change."
MMSPFVE,male,23,"I was completely taken aback the other day when I had to cut a  blank face to the question that Kalpana asked me, ""Sunny, what's your goal?""  Its been some time now since I thought about my future and I  wonder why I haven't been thinking about it lately. Is it because I am happy with what I am doing or because I am very busy to think about other things or is it due to the fact that I am a married man with a lot of responsibilities and blah blah blah ..  That certainly does not stop anyone from pursuing what one wants to do in this life. But, if I ask myself the question as to what do I ultimately want to pursue as that one thing which I would always love to do, I just don't know .. its like I still don't know what I would like to do for the rest of my life. I am  completely confused.  Well, my mind is never stable. I am always in the jumping state  and I hop from one state of mind to another faster than the speed  of light (now that's a stupid analogy). I guess I need to improve my concentration, which as I look at it now, is very poor. I need to improve my focus in life and try to find out that one thing  which I would love to do and find it fast.  Until then,   -+-"
