7M03OTX,male,24,"Well another boring day, not much going on at WORK today. The highlight of the day was Charley turning into a category one Hurricane and its projected path is South FL. Now, before I get excited and host my first Hurricane party, every hurricane that was projected to hit SOUTH FL last year missed us and hit the Carolina's (note to self, don't buy ocean front property in Carolina). So we will see how is pan's out. The good news is that I am a Conversion Analyst, converting over 600 offices to PeopleSoft, well that is not good news but. We have a huge conversion this weekend in which we are converting one of our largest clients (100 Million $ Account), I don't think we are ready, but upper management does not care, so the only thing that might stop this conversion is CHARLEY. Hmm, is it bad to want a Hurricane to hit, I guess I should ask my therapist, I will get back to you guys on that one.  I have a friend in town tonight, she rolled of the project a couple of months ago, and for some reason I am not that excited to see her. NO, it is not that I don't want to see her I just don't want to see some of the people that are going out with us tonight (i.e. evil bitch dog from hell) oops did I type that. Well I am already upset, because we where supposed to go to O'Heras on Las Olas. Now, it is one thing to go out and have drinks with 20 straight co-workers, and have a gay bar right down the street so when I am drunk I can sneak out and go flirt with GAY MEN. My co-workers don't understand, but who cares, anyways. To my dismay they fuckin changed the venue, to some trashy bar called Fox and the Hound, ewww, who would want to go there anyways. So who is the bitch that did not want to go to O'Heras, well it was Gayla so I am not going to hate, I might just not show up so there. I just don't understand the straights sometimes."
7M03OTX,male,24,urlLink    Yummy  urlLink
7M03OTX,male,24,"urlLink    Jane's in SOHO, are they staring at us?  urlLink"
7M03OTX,male,24,urlLink    Things that make you go hmm....  urlLink
7M03OTX,male,24,urlLink    New Years Party at Niels  urlLink
7M03OTX,male,24,urlLink    Fireman's Calendar Release Party  urlLink
7M03OTX,male,24,"urlLink    On this weeks episode of the Real World....  Today was not the best of days, got into a huge fight with someone whom I thought was a close friend, but turns out just to be a co-worker. Over the past year I have made so many new relationships with associates on the project. Some of those relationships have turned into great friendships. Some of these friendships I had hoped would last a lifetime, but don't always turn out that way. Life sucks sometimes, but I guess you have to keep rolling with the punches. It is sad sometimes when you invest so much into a person to get nothing in return or to finally see how they really are. I guess you could say her TRUE COLORS shined through brightly today.  Rena and I had a disagreement about how we have treated each other over the past couple of weeks, one of my issues is with her was honesty with me. Her issue is that I have not been treating her very nice the past few days and honestly I have not, because this issue has been eating away at me. So we where down at a co-workers cube visiting and she made a comment about something I said, I turned around and called her a mean word and we went back to our desks. Fifteen minutes later a get a long e-mail that pissed me off, so I wrote back and got everything off my chest, she in return said she is done with me, and that is fine nothing I can do but move on. Sucks when you speak your mind sometimes saying the things people just don't want to hear how they shut off. Honestly, I feel better about the whole thing, I guess some friendships are not worth fighting for.  It is very HARD to maintain some of the friendships on this project only because we work with each other 10 hours a day and since we relocated for this project leaving friends and family forces us to also feel the void of social activates after work. This sometimes is a recipe for a mess, maybe we need some time apart. Well hopefully my day tomorrow will be better, until then......   urlLink"
7M03OTX,male,24,"I had a great weekend. Aaron is out of town for the conversion, so Jenny and Maggie May stayed with me to keep me company.  We went to a house warming party on Friday night came back watched a few episodes of Sex in the City and went to bed.  Saturday, We watched a few movies and cried....( urlLink The Prince and Me  &  urlLink Love Actually ). I love romantic comedy's, if you have not already seen  urlLink Little Black Book , you must. I give it 2 Thumbs up. After the movies we went shopping at Aventura Mall, OMG, have to go cruising at this mall more, the guys are way hotter than at the Boca Mall. We spotted this hottie in Bloomies and he followed us into Gap, where we lost him, damn it. We are not creepy stalkers, besides he followed us. After a uneventful shopping trip we met my friend Kelly in downtown Hollywood to have dinner and drinks. Downtown Hollywood is cute (Hollywood, FL) I loved it a cute downtown seen with some trendy places to eat. Had a great dinner said our goodbyes and went home.  I am reading  urlLink Naked , by David Sedaris, he is so FUNNY, tried to finish, but I feel asleep.  Today I am at work.....over it, but this is my last CONVERSION so I am so happy. Took us a little over a year to finish the part of the project. Hopefully today will be smooth, until then........"
7M03OTX,male,24,urlLink    Britney's Concert in Miami  urlLink
7M03OTX,male,24,urlLink    Good Times  urlLink
64F8JNR,male,16,"Boring, boring day!!! I have french revision to do but i don't know where to start as i really can't be assed and i just remembered i have to finish writing my oral which is totally gonna bomb in the exham cos i'm crap wen it comes to remembering great big tracts of writing. I know i'll forget what i'm saying 1/2 way thru and the only reason i got an A last year is cos i'm good at the reading and listening bits but theyre stuck together this year and theyre not worth as much so i'm gonna suck!!! AAAGH!!! *stressed* there's too much going on in my head and none of it's helping!!! I just wanna forget all about everything and pass these exhams to get father to leave me alone about them! I need a lock on my door cos he keeps coming in and nagging me and it's getting on my tits.  Wow, Fookn essay or what? and only one person knows the address. Hmm... xxx"
64F8JNR,male,16,Why is it that i keep seeing things moving in the corners of my eyes? I'm going mad again *sobs*
64F8JNR,male,16,Big-Up to the most sexual Holly who found the website for me Scha-wing!
64F8JNR,male,16,"*Runs About* Helloo all you out there in computerland, The fantabulous Me hath returned. Today i saw Shrek 2 and It was tres funny and i have a newfound obsession with calling people pigeon. Then we were gonna go to nando's  for some spicy portuguese type food but it was full so i had to trek all the way to St. Benedicts to the Italian place. I forget the name. No, wait, Umberto's Trattoria Italiano. It does killer Lasagne. Well not literally, I lived to tell the tale. As you have witnessed. I'm now going to hut up as this entry is rapidly becoming the nonsensical jabberings of a retard Hmmm..."
64F8JNR,male,16,"I, I still recall, The first full moon in may, 'Neath whose rays we lay together, And those bright nights on glassy waves, When we would glide lightly away, From the grain, For wicked flights of pleasure.  Those visions fade, Like ghosts to lifes parade, Though incisions once made her so vivid, A scarlet whore, With both heels in the door, Of a heaven severed from me, Insipid.  And midst the writhe of parapets, Where angels sigh, Lonely she sits, Upon the lip, Only a slip from whence I beg her.  That i would wish, Her kiss a chrysalis, To break to make my fluttered heart amiss, And in those frozen moments won, From grief that creeps to wreathe the sun, In drapes inwove with deathshead wing, I thank god for the suffering.  Love would have conquered all, But for the rapture, That ancient plan for my defeat, Denied faith skies that would have set her free, It seems again dreams wend to capture  Once dancing in a spotlit waltz, Through a shadow dimension, Given to the rivers that bedizened her eyes, The world drifted by in lost momentum  With no divine intervention  Regardless that the author, Of sin was me and I, Lay chaste of hate in Faith's embrace, As mortals warred with more besides  They warred with life itself, And in those frozen moments won, From grief that creeps to wreathe the sun, In drapes inwove with deathshead wing, I thank god for the suffering.  And i thank god for the suffering, As i still burn, For her return I would make my peace with everything  I, I still recall, The first full moon in may, Consigned to flames like secret letters, And midst the writhe of parapets, Where angels sigh, Lonely she sits, Upon the lip, Only a slip from whence I beg her.  That i would wish, Her kiss a chrysalis, To break to make my fluttered heart amiss, And in those frozen moments won, From grief that creeps to wreathe the sun, In drapes inwove with deathshead wing, I thank god for the suffering.  Love would have conquered all, Were we not parted, her splintered loss rekindles rage, the winter frost dwindles across my stage, lit up once more to score finales started.  Love would have conquered all,  Love would have conquered... Hate"
64F8JNR,male,16,"What a dismal day, the sunshine has all gone. not that i've been outside anyway so i don't see why it matters, but theres something rubbesh about having to have the heating on at this time of year. Maybe it's just this draughty old house. I finally finished writing my french thing but i'm not gonna check it with Mr. Stone cos he'll pick at it and it'll end up saying what he wants. Is it just the french teachers i have had that do this? Probably not but as only 3 people have my link i'll probably be in a minority. I sound really bored and depressed in this but i'm actually not that bad. Wow, i went through a whole entry without mentioning holly oh...nuts... Hmmm..."
64F8JNR,male,16,OK I take that back cos shes coming al the way from miton keynes to give me a hugcos i told her to. I wonder what else i can tell the sexy lil' minx to do *ponders*
64F8JNR,male,16,"Prepare for a moan! Grr! I hate study leave! It's so much worse than school, at least then i have people around me to make it bearable! At home i don't get anything done either cos i'm spending all of the time being told to do something, or cos i'm answering fone calls that arent for me. The fone hasnt stopped ringing all day. well, thats not quite true, it stopped ringing wen i answered it but 10mins later it would ring again. Why doesnt anyone ever ring me, my parents are always getting fone calls. If i ever meet Alex Fairhurst of the medical sickness centre i'll shove everything within arms reach up his nose. TWAT!!! Leave me alone, she'll ring you when she gets back! I don't need to be rung to ask whether she's home yet cos if she was, she'd have rung you. YOU TIT! And i have tan-lines again. I'd rather be pale, but noooo, i have to have weird looking arms! fuck tits ass bollocks wank etc...!!!! *calm* Hmmm... P.S. - Holly! Haha It does now :p"
64F8JNR,male,16,"I hate microsoft so much! I'm always torn between going on my pc on crap messenger and going on the windows oopstairs which cuts me off and crashes and is just generally a git. You'd think it was obvious to stay down here and be cool on the beautiful Mac but the lure of webcam with the tres beau holly is sometimes too great. But then it fucks up and i hate it! I want posh messenger! *sulks* *tantrum* Yah, ok, i'm done! But yah, that suckaroo's. And it's gig time this sat! Holly come see me! Pwease! xxx"
64F8JNR,male,16,I WANT MY GAMEBOY BACK!!! Damn you paul and your crappy pokemon addiction! *stamps foot*
QTSYZJV,male,26,"As you can see I am updating my blog.  I am trying to learn how to do this sort of thing on my own so I can start working on the Barley and Hops website for Nate.  My next task to reapply the links to everyones blogs.  Bare with me.  Getting prepared for a monster weekend.  Beer gardens is Friday and should be fun.  My plan is to go out after class, have a few drinks, come home and eat, and then go into work and turn that mutha out.  I don't see any holes in that plan.  That is all I gots. Later."
QTSYZJV,male,26,"I am not  urlLink Michael Jordan .  I did not score any points on a professional basketball court.  I never played minor league baseball.  I did not retire from my job three times.  I can serve two drinks at once.  I do know how to make about 20 different variety of shots.  I am Ryan Hayes, his bartender."
QTSYZJV,male,26,"Lately, it seems to be the fad to pick on me and various aspects of my life.  That is fine, just watch your backs.  You know who you are.  On to more serious matters.  urlLink Kylie Minogue  is pretty hot, so is  urlLink Leann Tweeden .  But if you like looking at girls from closer to home, watch the new  urlLink Girls Gone Wild  video and you should see a bunch of girls from Oshkosh.  One more thing, even though I can not vote, if I could it would be for  urlLink Wesley Clark .  I just kind of like what he has to say.  That is all"
QTSYZJV,male,26,"So, nothing new really happening in my life.  I do have to say even though it was hard to dismiss the obvious, I still held out hope that  urlLink baseball wouldn't be tarnished by cheating .  The last 7 years of baseball regrowth has been ruined by a few cheaters.  Many people in the media say that the  urlLink fans do not care  about steriod use in professional sports.  Being a fan, I say that they are wrong.  It reminds me a little bit of breast implants.  When you see them for the first time, you know that something just ain't quite right.  If you are lucky enough to play with them you feel incredibly excited for the opportunity to view greatness.  And when you find out for sure that it isn't real, you feel a little smaller for having ignored it when it was so obvious to everyone around you.  I imagine that to be the case when dating a  urlLink girl with fake boobs  as well.  Speaking of steroids,  urlLink Wrestlemania XX  is happening in less than 2 weeks.  I currently do not have a venue to enjoy the extravaganza.  Anyone willing to host this event on their TV would be my personal hero for at least 5 hours. (hint KP or AC)"
QTSYZJV,male,26,"I just discovered something about my 4 and half year stint at Hollywood Video.  I watched a lot of movies, most of them crappy, simply because they were free.  As I walked the store today, nothing seemed appealing to me.  I just hope the same thing happens when I am done getting drinks and sex for free at my job now.  OK so I am just getting the drinks for free.  I still have to work pretty hard for the sex."
QTSYZJV,male,26,I always kind of wondered what the bus driver did all day after they dropped us off at school.
QTSYZJV,male,26,"Just wanted to remind those of age and interested, I will be throwing our 2nd annual Wisconsin Daze party on Friday.  Festivities begin at around 12:30 pm.  Was a great time last year and expect more of the same this year.  Alright, back to my homework."
QTSYZJV,male,26,"A tribute to the Mann.  When you agreed to live with me I knew it was with some hesitation, but I knew that you could live through it.  You had some reservations about the other person that you would be living with.  In the months to come I think you came to accept and deal with the faults of both your roommates.  I just wanted to take the time in cyberspace to thank you for the time that you have taken to enriched my life with by living with me.  I know that I am not the easiest person to live with, but who is.  I learned that by you living with me that we are truly good friends.  I know this because we were able to live together and remain friends in the end.  I believe that we are better friends because of it.   Good Luck to you on your future challenges and always remember that I am here for anything if you ask.  My good friend Chris Mann, University of Oshkosh-Wisconsin graduate and one hell of a MAN.  Salute!!!!!"
QTSYZJV,male,26,"Wrestlemania update.  Nate is a friend of myself, Chris, Som, Kevin and various other media outlets.  I believe it will be going down there.  I think it will be a BYOB type of deal.  I will consult him before the week is out.  In the meantime enjoy this funny thing. It is an ad considered to risque for us.   This is also funny."
QTSYZJV,male,26,"So I am going over my personal entertainment budget for the next month and I am a little surprised.  It is going to cost me a lot of money to go an see OTHER PEOPLE get married.  Now I am all for these glorious union of souls, but should it get in the way of my good time.   One wedding I am just going to and I am not even bringing a date and I figure to spend at least $200 on it.  I come to this conclusion because I have to pony up for a hotel room and I lose a Saturday night of working, easily my most lucrative.  The other wedding I am standing up in.  This will cost me the price of a tux, gift, hotel room, hooker for the night.  This wedding I figure around $250.  And I have not even thought about bachelor parties.  D'oh.  The sad thing is that I am probably getting off pretty easy this year.  Next year my sister is getting married and I have to travel to the homeland for that. My friend and boss Nate is also getting hitched and I am just scared of the bachelor party.  That being said, this weekend is the 2nd Annual Barley & Hops X-mas party.  This will probably be the last weekend this summer that I really cut loose.  Those of you invited to this soiree, you are officially warned.  That is all."
FJTPK9I,female,15,sandali lang akong online.   had a terrible day. had an headache. had an hangover during bio class because of the stupid Business Math class and was not able to absorb the first few lesson. and the damn day is too long!!    teachers gave us so many assignments. each class has an assignment!! good thing I was able to do the one for the stupid BM class during study period. finished the one for filipino... OMG. I almost forgot about the one for ENGLISH!! generic and specific worrds....easy lang yun. and I still need to study for AP....need to memorize...  so...yun.
FJTPK9I,female,15,urlLink    urlLink    urlLink     urlLink    urlLink    urlLink     urlLink
FJTPK9I,female,15,"I still don't want to go back to school. Returning to school is not the way I want in order to see my friends. The last meeting I had with them was 2 months ago. But still, I was able to call some of them once in a while.  Hay bwiset. There were many things that I wanted to do this summer. May nangyari ba? ha-ha. wala. So maybe next summer na lang. Since time made it show that it flies so fast. Maybe with a snap of my fingers...summer na naman!   I just hope na hindi ako tuluyang mawala katulad last year. Hopefully at least once a week makapagonline ako dito! ^_^"
FJTPK9I,female,15,"Sandali lang talaga ako.   So alam nyo ba na 11 na ang subjects namin ngayon?! I just dont know kung paano pinagkasya ng skul ang maraming subjects plus nabawasan yung 40 mins pero nadagdagan ng 30 mins ang break namin at 5 extrang period. Ang haba tuloy ng araw.   Gawd, matagal pa ang softball namin sa PE. I still need to wait for the 4th QT parang mangyari yun..?? I just hope and pray talaga na makakapasa ako sa Softball Club. Swimming kami for the 1st semester. Were gonna learn how to do sychronized swimming.   So...Im nervous with all this HOUSE thingy. [ot: ang cute ng lamang loob ng baboy...] I dont know if im gonna cooperate with them or not. Mapapalibutan pa ba naman kami ng 3rd yrs and 1st yrs??? Malas talaga o. At hindi na by batch ang itrams...at every 2 years na lang sya!!!! BY HOUSE NA!!  Sana makasama ko ang mga co-softball members ko...  naku...i still need to look for the meaning of panitikan..."
FJTPK9I,female,15,"I finished reading Things Fall Apart!! Ala nga lang summary, kakatamad e. I was falling asleep nga kanina habang binabasa ko ito. Sino ba naman ang hindi aantukin? eh nagising nga ako ng 5 diba? tapos hindi ako kumain ng breakfast..  I just know na nagpakamatay ang bida. Ang papanget talaga ng mga endings...  So went to the dentist. So...ang sakit. May ngipin na talagang masakit e. Parang mabubungi sya. Don't like the feeling...*sigh*"
FJTPK9I,female,15,"Had an headache from breaststroking(??). Good thing wala kaming practical test dun. I think I finally did it right. lol There's a cockroach in the bathroom!! And lumilipad pa siya. Buti na lang...lumabas siya dun sa bathroom room...lol its not a room kasi e. open sya sa labas...While doing the push thing i raised my head and i drank a lot of water...ewww...  anyway, almost every afternoon Choups(not her real name) and I kept on staying at the cafeteria doing homeworks while eating. Most are algebra homeworks, we compare answers and those kind of things. And a while ago, we didnt knew how to answer the very easy question so coincidentally we saw our algeb teacher and she told us what to do. Natuwa ata sa amin si Ms V. Now the teachers have a good impression on us - lol. eh were the type of nerdy looking because of the glasses and braces. Then i said something like ""Akala mo naman kung sino ang mga matatalino...yun pala ginagawa lang nila yun para magkaroon pa ng oras sa internet!!"" bwahahaha - lol.   We had a sort of make up quiz for AP since most of us had failing marks in the previous 20-item quiz. He mentioned it last Mon or Tues but we were not sure if were going to have it today. Some were studying during lunch but unfortunately, I have to do something for English and had no time to study. And I didnt even open the book last night. I mostly guessed the answers and I still got the same score from the previous quiz!  And for the whole week, we watched Mula sa Puso the movie during Filipino classes. Ang cute cute ni Rico Yannn!! Yun lang lol.  I want to make a site…site ko lang. Di nga lang ako marunong. I have the idea kung paano sya ginagawa pero…di ko talaga kaya!!!   Oh..kay…Seldy called a while ago asking if I could do her a favor. Its about the group reporting in English. She wants me to draw the king of the demons, Ravanna. Eh di ko alam itsura nya. So I have to look for a picture in the net….and that’s what I gonna do now."
FJTPK9I,female,15,*sigh* Boring.. I slept. I slept. I slept. What else is new? Then I just did some mms wallpaper (kung ano man tawag dun) for a friend na may site.   oooh. Delayed reaction lang. Heeeeeeeeeeeeeeeeeroooooooooooooo!!! weeeeeeeeeeeeeeeee! Siya na nanalo!! Si Hero or Roxanne ako. Happy ako para kay Hero! Deserving naman siya diba? Kailangan rin niya ng pera so...masaya ako. :)  Hm...I have nothing else to write here. Walang wala ako ngayon? Not money...magagawa lang.
FJTPK9I,female,15,I am so so so so so happpy todaaaaay!! Finally nakapag softball na rin ako! Well di ako nag game. ayaw ko muna. saka daming tao. we're...45. So many 1st years and 3rd years... Basta! Cant wait for next weekk! and *drum roll* Unit Test I na namin next week. From monday - thursday tig isang subject bawat araw. I guess that's ok. But I think I'll fail in AP. di ko alam kung ano ang mga ibibigay ni Sir B. Mga quizzes ko nga sa AP pasang awa lang e. Ang hihirap kasi e! Geology ng Asiaaaaaaaa!! Di ko talaga kaya ito. And we have to pass 2 projects and 1 movie review on monday!! Kaloooka! Im gonna die........
FJTPK9I,female,15,"Gawd, My brother's annoying. VERY annoying. Nakakabwiset na talaga. Gusto kong mapag-isa dito sa kwarto ko at manood. Darating siya bigla at sisirain nya ang mood ko. Tapos ayaw na niyang umalis sa kwarto ko. Si mama naman kumakampi sa kanya. Nakakabwiset talaga. Ano ba problema nya?! Tapos pag pinapaalis ko sya nagagalit siya. Bwiset talaga. Ganun ba talaga ang mga lalaki?! Lagi na lang sila KSP?!? Lagi na lang siya ganyan! Bigla biglang susulpot dito sa kwarto ko at ayaw nang umalis. Tapos may gana pa siyang magalit?! Eh siya nga ang nag-iinvade ng privacy ah! Inaano ko ba siya?  Ginugulo ko ba siya? Hindi! eh bakit ba siya nandito!!! Ayaw umalis! Bwiset siya!!"
FJTPK9I,female,15,"I found a baby bird a while ago. Talagang kaka-hatch lang nya. The bird's still naked. lol. No feathers, and it's eyes are still closed. I still don't know if it will live and fly...fly awaaay. I was about to feed the kitty when I saw it on the floor. Akala ko nga daga e. Well, I think we adopted it. lol. Bahala na si Mama dun. May kuting na akong inaalagaan.  I told Mama na magiging Adoption Center na bahay namin. Well, binigay lang naman yung si Lucky at Jumbo. So yung inampon ko lang talaga yung Pusa. hehe.   Oooh. About a while ago. I wrote here that I would do some scanning. Well, I really did. I even took notes coz I know I'll forget the story. FYI, We will read that book on the last Quarter. Nice eh? Eh...that's the only one I can read right now. I don't want to read Florante and Laura. I'm gonna die if were going to act again in Filipino..."
ASLB0XH,male,26,urlLink PDF zone - The online authority for PDF and Adobe Acrobat professionals
ASLB0XH,male,26,urlLink MSN Search -- More Useful Everyday : MSN releases a preview version of their new search technology. They've been making large strides to compete with Google and Yahoo. I'm not sure of their algorythms or the factors that play into how they search. If anyone has any insight into this please share!
ASLB0XH,male,26,urlLink Search Engine Results Chart  Danny Sulivan does it again! Here he shows several charts in addition to the well know Bruce Clay Search Engine Relationship chart. Check it out!
