ASLB0XH,male,26,"urlLink What Is RSS ?   RSS or 'Really Simple Syndication' is an Internet standard just like HTML (i.e. the web) -- with one key difference -- delivery.  When you use the web, you're constantly browsing, searching ... seeking information.      With RSS new information -- information that you select and information you can turn off at any time --  is automatically delivered directly to you.   This information is called a Feed since it feeds direct to you.  An RSS feed is sometimes indicated by [an]orange [XML] icon...    Within an RSS feed there can be text, links pictures and more just as you find on the web.  The different 'chunks' of information within an RSS feed are called posts.   Analogy: Think of RSS as 'Tivo for the Web'."""
ASLB0XH,male,26,urlLink Google's PageRank Explained : What is PageRank? Well come here for an overview and look for more articles that help out on this topic.
ASLB0XH,male,26,"urlLink Yahoo! Help - : ""What are your guidelines on spam?""   Again and again SEO firms attempt to ""trick"" the search engines into raising their clients' rankings to increase their sales. Sure there's a need for this, however Yahoo! and other search engine giants continue to change their algorythms to eliminate bogus websites from their listings.  One point that Yahoo! tries to make again and again in their guidelines is to create page for humans, not for search engines. Tricks like duplicating your website with different urls, redirecting your visitors to other places, and using extensive linking to inflate rankings are becoming more and more under attack by the search engines.  Find legitimate ways to increase rankings and sales."
ASLB0XH,male,26,"urlLink How Often Should I Submit My Site To The Search Engines? : Again, the answer seems to be now that search engines are more advanced it's not necessary to be submitting your site once a month or everytime you make changes to it. Trust in the power of the web. You'll be okay.   ""So the answer to your question is, it depends. If you're talking about Google, don't submit your website at all. Just do a few link exchanges with quality sites that are already ranked well with Google and let Googlebot 'find' your site automatically.  If you're talking about Inktomi, Altavista, and some of the others, using their 'Express Submission' services can speed things up considerably, but it isn't really necessary.  And remember, once your site is indexed in the search engines, re-submitting it will simply be a waste of time and/or money."""
ASLB0XH,male,26,"urlLink News Aggregators: All About Delivery : ""Just has you have a browser for the web, there are browsers for RSS.  These browsers are called News Aggregators or 'Aggies' because what they do is aggregate, i.e. gather and present new information.     Summary to date:  RSS is a way for you to have new information sent to you automatically.  The reader has complete control and can turn off any feed at any time.  This means there is never spam.    Within an RSS feed there are multiple chunks of information called posts.    An orange XML / RSS  (  )button or a text link like 'Syndicate' lets you get a site's feed.    A News Aggregator lets you view your collection of RSS feeds."""
ASLB0XH,male,26,"urlLink Its All About those Little Orange Buttons... : "" Any website, weblog or even any ecommerce site can provide information to you as an RSS feed.  Even Amazon is publishing RSS feeds now, as are the New York Times, Yahoo News, Harvard, Microsoft and millions of others.     When a site has an RSS feed or feeds available you might see something like one of these:   Syndicate This Site (XML)  (RSS)    What these text labels and icons mean is 'This site has an RSS feed and here's the URL'.  And if you see one of these then you can subscribe to that site and have its content delivered to you.   Not sure if a site has an RSS  feed?  Click here to use our FeedFinder which automatically discovers RSS feeds for a site.     Sites don't always label RSS feeds consistently so sometimes you have to really look for them."""
ASLB0XH,male,26,urlLink Google Ranking Factors List . When you talk about optimizing your website following as close as you can to some of the most common practices is best.
G0ZNF9M,female,23,"01 ... what do you do for a living?  nothing actually, i'm a full time student even though i haven't had a full load for a while now, maybe this fall since i changed majors and will be doing something i enjoy   02 ... what do you like most about your job?   i've had jobs, the only thing i liked or the thing i liked the most and disliked the least was getting paid, i actually didn't like it a whole lot because they tax you like crazy   03 ... what do you like least about your job?  working, it's hazardous to feeling young and punk   04 ... when you have a bad day at work it's usually because _____...   the people around me are incompetent or ... because i realize i'm working   05 ... what other career(s) are you interested in?  i've been several different majors, currently i switched over to video technology which i feel is my call and always has been but i also have a lot of interest in surveillance technology and journalism"
G0ZNF9M,female,23,"today i went to movie trading company to sell some movies on videotape i still had, i didn't want them anymore, they took up too much space   accidentally i ran a red light, the black suburban coming at me stopped i daresay two inches away from my bumper, not because they couldn't brake in time, just one of those aggressive drivers   turns out the black suburban was going to movie trading company to sell videotapes as well, when i got out of my car, the driver of the suburban did too, she had three children in tow, she started screaming her head off at me, i was about to apologize for cutting her off, i didn't after that, i was getting red hot with anger at that point but i didn't say anything since she had small children and all, i went in the store and got in line   as she came in she was bitching and cussing and being a one woman show, she told her children ""if she hadn't cut us off at the light, we would be first"", one of her children of about 5 years of age said  she should've gotten a ticket mommy, she's a bitch"", several people turned around at this remark and so did i   ""contain yourself and your child before i stab both your hearts out""   she started walking toward the exit door saying she was dialing the police on her cell phone, to which i said   ""i was reconsidering stabbing you since i'm in a hurry, but now i really think i'm going to"""
G0ZNF9M,female,23,"you scored 25% Artemis   if you are ruled by Artemis, your independent spirit belongs to no one but yourself, your body is vibrant, your attitude robust and your manner vigorous and alive, you are driven by physical rather than mental energy, you feel complete without a man in your life and would never compromise your essential nature for a romantic partner, you are skilled at establishing personal boundaries and enter into relationships on your own terms -- in short, you can take care of yourself, this attitude may at times put men off, but if what you're looking for is an equal, loving relationship, take some tips from Hera   i didn't cheat on  this  test by the way, i AM t  his cool =0p"
G0ZNF9M,female,23,"""But not fighting does not always equal a loss. Sometimes that is what is needed. Must take it moment by moment. Don't push me, cuz I'm close to the edge."" Chris,  I was not made to sit still and do nothing. If others can idly watch while the shit hits the fan, goody, but I can't, I won't. I don't agree with that defeatist behavior and I won't ever think it's an acceptable course of ""action"". I respect those who choose to sit back and ""see"" how it turns out. I think individuals are entitled to execute their God-given free will. But just because I respect that someone's a moron and let them be in peace doesn't mean I think they're right. It just means that I want the same respect from them, I want them to leave me be in peace. In my experience getting off your arse is half the battle, unfortunately the mentality of sitting still and waiting for divine interference prevails."
G0ZNF9M,female,23,"jedi masters     storm trooper     me hitting on the storm trooper =0p     my man and me     this is nico, he broke the lightsaber and he had to buy it thus the face, $40 OUCH!   lesbian time    trish and me (acting tall)"
G0ZNF9M,female,23,"#1 ... what does it say in the signature line of your emails?   it reads ""-Girl Deal"" but i always delete the signature before even i start to write an email, i've been meaning to get rid of ""it"" [the signature] forever ... i first set it up when i got my email account but i'm too lazy to go and change it back to nothing ... yet i'm somehow not too lazy to write this long winded explanation about it   #2 ... did you have a senior quote in your high school yearbook? what was it? if you haven't graduated yet, what would you like your quote to be?   ... no i didn't have a senior quote, i didn't get to be a senior in high school, ... i'll never graduate either because i've moved on to better and bigger things [college] but if i had the chance it probably would have been something highly aggressive even though i can't think of anything good right now   #3 ... if you had vanity plates on your car, what would they read? if you already have them, what do they say?   if i had vanity plates ... it would be something cute more than likely, something very self indulgent like, ... PRINCESS or DIVA or CUTIE or QUEEN  ... i feel however that PRINCESS embodies all of the other possibilities so that would probably be my pick   #4 ... have you received any gifts with messages engraved upon them? what did the inscription say?  thank god i have not received such things, odds say i would've thrown it back in their face whoever it might have been ... except mother of course, i'm afraid of her   #5 ... what would you like your epitaph to be?   epitaph? what's that? ... hold on, got to run to merriam-webster.com be right back ... ok got it, good ... SHE WAS LOVED   http://www.fridayfive.org"
G0ZNF9M,female,23,just because you like something doesn't mean you're good at it
G0ZNF9M,female,23,"propel (strawberry & grape)  diet snapple peach tea  bubble tea (tapioca)  smoothie king's ""strawberry x-treme""  french vanilla  natural orange juice  cream soda  rice water  tepache"
G0ZNF9M,female,23,"if for only an instant God would forget that i'm only a rag doll and gave me life, i possibly wouldn't say everything i think, but i would definitely think everything i say   i would value things, not for what they're worth, but for what they mean   i would sleep little, dream more, i understand that for every minute that i close my eyes, i lose sixty seconds of light   i would go on when the others stop, i would wake when the rest sleep ... i would listen when the others talk, and how would i enjoy a good chocolate ice cream cone   if God granted me life, i would dress simple, i would lie under the sun, baring not only my body but my soul   my God, if i had a heart, i would write my hate on ice, and wait for the sun to come up ... i would paint with the dreams of van gogh on the stars a poem by benedetti, and a song by serrat would be the serenade that i would offer to the moon   i would water roses with my tears, so i could feel the pain of their thorns, and the sweet and subtle kiss of their petals ...   my God, if i lived ... i wouldn't let a single day go by without telling those i love that i love them   i would convince every man and woman that they are my favorites, and i would be in love with love himself   i would prove to men how wrong they are to think that they stop falling in love when they grow old, without ever knowing that they grow old when they stop falling in love   to a boy i would give wings, but i would let him learn to fly on his own, ... to the old i would teach that death doesn't come with age but with forget   so many things i've learned   i've learned that everybody wants to live on top of the mountain, without knowing that true felicity is in the way one climbs said mountain   i've learned that when a newborn hangs on to his father's finger with his little hand for the first time ... he has him forever   i've learned that a man can only look at an other man down, when he would help him get up"
G0ZNF9M,female,23,"i'm hungry, sleepy, and i don't want to go to class tonight  i'm not getting any food or sleep and i have to go to class  what a bitch ..."
MAWG9RF,male,25,"you know what i hate most of all?  i hate the fact that i don't care about things.  i am too apathetic.  oh well.  i also hate the fact that people just ruin my hopes and dreams.  i have dreams that i will be getting back together with ""her,"" and that everything will be alright.  but i have this friend who thinks other wise and rains on my parade that she doesn't see us together... she tells me this everytime i have a conversation with her.  this angers me.  i give advise to a lot of people, i encourage them and what not... and then in turn they say i am wrong for hoping we get back to the who dating scene. (am i lonely or what?) oh well, what can i do?  basically nothing.  sucks.  and no jeremiah, she doesn't have man parts.hey! at least i don't think about her all the time anymore.  but i do think about her when i am alone (ahem, now!)."
MAWG9RF,male,25,"uhhhhhhh... I don't know. Brooke got my e-mail... yeah. chatted with her a bit... don't know.  I just don't understand. you think... maybe that's my problem... you think things are going one way, stuff happens, list of possible reasons for stuff happening, then when inquiry is made, nothing is really cleared up. not sure if things actually were going the way you had thought, not sure why stuff happened, not sure what to do, just know that Brooke doesn't feel well. and I'm afraid that it's my fault.  she doesn't want our friendship to change. I don't want our friendship to change. she doesn't want it to be weird, she says she doesn't feel weird. I don't want it to be weird, I don't know how I feel. I still like her, I know that, but I am brought back to the question of fascination... she doesn't want a relationship at this point, ok, that's all well and good but... she doesn't think she feels the same way but she's never thought about it. I don't know, I don't know, I don't know...God help me, I think I'm losing again."
MAWG9RF,male,25,"ah turn about....yeah i hear ya on the ""nuts in a vice"" felt like that all last semester."
MAWG9RF,male,25,I found out there's a computer here in the hotel I can use..(I'll explain later) so I'll try to get down here and keep you all updated on my life. talk to you all soon.
MAWG9RF,male,25,"ok, so I'm the only one on this blog right now and I've been doing a rather poor job of continuing to add to it... well the Brooke update is quick... it's still peanut butter man! at least I think it's creamy now instead of crunchy... that has to mean it's getting better right? I haven't really talked with her though so it may crunch yet...   I spend too much money! I have to slow down here... save some money for things I really want, or even put it towards paying off my bills in a more rapid time frame. alas... a lass... now that would be nice!  working on a new song, not quite there yet with the lyrics but I think I have a good title for where the song seems to be headed: questions and apologies. maybe I'll just list it as Q&A on the outside of the cd I'll have someday(hopefully by the summer)... and then perhaps the full title can be written out inside... hmmm... ideas, thoughts... we'll see. I realized that I have much more free time than I had previously realized... I believe I should use this time a bit more wisely than I have been up to this point. not that I don't enjoy the time with my friends, but rather than it just being routine for me to ""hang out"" with them, I would like to spend more time playing/writing music, reading, studying, praying, and even just plain soaking in God. oh man oh man, that would be sooo great!   gotta get my music in order, record a cd, play shows... gotta gotta praise God, live my life as worship... (that should really be listed first!)... lookin' forward to habitat (it's going to be freakin' rad yo) gotta make more money(pay off some bills, save some money, get some more musical and sound equipment) gotta make sure to be attentive to keeping up friendships, can't lose 'em, become distant  aright... God bless any who happen upon this (by the way, if your reading this, you're prolly the only one) so long..."
MAWG9RF,male,25,"first off, stupid geocities is discontinuing their ftp, so I have to find another site to put this thing on... no worries, I will remedy this situation, and I will create a link to the new page when it exists so you don't have problems finding it, or remembering the new address. now on to the next...  what is it about girls that drives us so mad?  is it their unique thought processes, the way they look(yes their figure, but no I'm not suckered into the American stereotype of what one should look like), the way they walk, their smell, or is it that God saw it wasn't fit for man to be alone and so created woman to partner with us, keep us company, love... perhaps it's because of God giving us the wonderful gift of women that all of those little things about them attract our attention and make us want them so. so here we are, let's call ourselves men, longing after some girl to come along side us and share her life with us, that we can love and share our life with... (perhaps someone specific, perhaps the idea or just someone...) but it seems like every turn, every curve in the road, we get frustrated and confused because they are different, they don't think the same way as us, the react strangely to things, and we just don't understand.  but we go on, hoping that the next time it will be different, that this time she'll ""come around"" and everything will work out for once... then we're left wondering if it'll ever ""work out,"" if their truly is someone for us, or if we're doomed to an existence of solitude, with no one their to share life with, no one to love and to cherish 'til death do we part.(and hopefully not even then)  do they realize what their doing when they do it? do they even realize it anytime afterward?  God help me, God help us all.  nuts in a vice... ""shaking head no"" (sigh)"
MAWG9RF,male,25,"camp was definitely good. I have some stuff to sort through from camp though.. so I don't know how much I can really write about it right now. it was good, God is working, I'm still learning (and waiting.. everything in God's timing)  lack of funding.. heh.  novemberish.. that should give us plenty of time to work something up. I need to work on music more. I don't spend enough time developing it.    I sat down hoping I'd be able to write some stuff.. but things just aren't flowing today. I gotta go.."
MAWG9RF,male,25,"waiting... waiting for the mail man... or at least the you have new mail signifier on the computer... I'm sure everyone is just busy... at least that's what I'm going to believe for now. habitat was sweet as molassas! of course there are things to improve, but that'll always be the case. I'd have to say that it was a complete success, especially for the first night. but if we can keep the numbers we had tonight, and have that to grow from, that would be sooo sweet. sweet like the swiss chocolate I had yesterday. mmm mmm good!   Johnny was back at work today... it's good that he's back around after his 10 day hiatus south of the mason dixon line. then our boss John was just extra JF today. I don't know what his deal is. Bobeng attributes it to his diabetes. I suppose that's a good reason, but geez! I really need to start making some money on the side. Windy City just doesn't cut it if I want to actually get an apartment. yikes! financial resposibility. oh, it turns out that my parking ticket fine was due yesterday. so I missed out on that, have to pay an extra $10 now. what really bites it is that when my mom called me at work to tell me, I found out she was sick with a massive fever and just getting ready for my dad to come home and take her to the doctor. God bless health insurance! I hope she gets better soon, she seems to have this nasty habit of sickness clinging to her. here's to God breaking that curse!  well hopefully soon I'll now something more. I'm still waiting for some form of enlightenment."
MAWG9RF,male,25,"welcome back ed. lightning is a gorgeous creation that has the power to entertain, excite, scare, and destroy all in the same instant. I saw some great examples of this wonderful display we call lightning on the way home this evening.. ah yes.. on the way home. I went to quencher's tonight for their open mic night. I went to enjoy and kind of feel the place out for future opportunities. talk about future opportunities! I actually ended up playing a couple rough songs at the very end. my voice was nothing short of dieing on me but it was fun. eric(the guy who kind of heads it up.. a former employee of wcm actually) said that he wanted me to come back next week and play earlier in the night when more people would be around. most certainly. so then I mentioned that I could help out with the sound too if he needed it. *wam* opportunity smacks me upside the head. (praise God. He is so awesome. I love and appreciate Him immensely) looks like I'm on the sub list for running sound there now. (yeah.. woo hoo!) I got his phone number and he introduced me to steve and I gave steve my number so they could get a hold of me. looks like I'll be heading down there tommorrow night(tuesday) to get a grasp on how things work there and where everything is. ( \w/ rock on!) apparently it's some jazzy group tommorrow or something, and it starts 'bout 9:30pm. (sah-weet!) I'm excited. what's funny is I was talking to shawn today (this guy I met through elliot on a windy city show.. he's goin' on tour with converge in a couple weeks to run sound for them. now that's cool.) he was talking about going to some club and talking to the sound guy there and basically getting in like I did tonight at quencher's. sometimes God moves quicker than we expect. I probably wouldn't have said anything to eric about helping out if I hadn't talked with shawn about such thing earlier in the day. man, God's timing is weird/amazing/ perfect . (that really gives me hope for waiting) I'm stoked! got to play some tonight. gonna play some wednesday night at the ashbarry coffee house. get to hang with daniela during the day wed.. go to church (christian hills) see kyle flannigan probably. see brooke. ""working"" tommorrow night (learning the ropes at least) maybe hanging with will friday night and going to that ihop (international house of prayer ...no not pancakes) extension that's in the area (and if not this friday, then prolly soon at least :)  summer kick off bar 'b que for habitat thursday night. hopefully souled out again this saturday.(I like going there. I always seem to get something from the service) what a great week in store for seth. it makes me quite happy. (and I already talked about going over to chuck's last night after chillin' with dan culp for a while. that was cool too) I need some rest. still fighting off this cold ( or whatever it is.. it sure is annoying!) have a great day and God bless.  ps oh yeah.. almost forgot. looks like from the calender above the bar that there is an open jazz jam (or something like that) on sunday nights. I know some of you like jazz. we shall have to go sometime.  pps I love you."
MAWG9RF,male,25,"well, well... I am quite satisfied right now; having had a bowl of spaghetios w/franks(plus a little spice) and a wonderful glass of milk.  I really need to discipline myself... I was an hour late for work  again !! ah well... the rest of the day was quite nice actually(as of yet, and I assume nothing less for tonight) I bought a compressor... yes I'm very happy about that.   sometimes... I wonder, how much of a gomer am I really? I think too much, one of these days that will work to my advantage. I just hope it isn't my downfall...  why can't I just leave things well enough alone? we shall see. yes, we shall see.  ttfn  (ta ta for now)"
9MOAJR2,female,34,"I had a short conversation with Precious this eve after a breakthru recovery with Eben.  The spanking she recieved reminded her of the place she wished to be.  I have told her I feel at times more a council than else.  Tonight she needed to be mentally cuddled a bit.  Have tried to explain to her that more than anything else she is a brat.  Equal to all in all manners save for her sex.  There she needs a strong hand to force her submission that she may experience all that she can at her most free.  She doesn't understand yet but she will.  Her side of the scene with Eben was exstatic save for one thing, she felt an overlong pause needed a new warm up session.  Her concern was rewarded by Eben.  One of her rewards was to watch her favorite tv programs uninterupted as long as she remained unclothed.  Upon listening to her side and hearing most of his, I gave her instructions to perform for me during this 'Reflectory' period.  To enjoy her tv program but during the comercial breaks to take his cock into her mouth.  Not a blow job, not a suckle, no suction or swallowing, simply to hold it in her wet warm mouth for the duration of the comercial.  A fitting way of reminding him of warmth deprived and the thought of teasing him so seemed to give her much thrill.  I hope to hear soon how the evening progressed."
